product_id,product_name,description,price,image_url
35506,Brown Sugar and Cinnamon Steel Cut Quick Oatmeal,"Quaker, steel cut quick 3 - minute oatmeal, brown sugar & cinnamon",11.1,https://via.placeholder.com/300x300?text=No+Image
35559,Kellogg's Chocolatey Peanut Butter Granola Bars,Quality kellogg's chocolatey peanut butter granola bars - fresh grocery product,1.71,https://via.placeholder.com/300x300?text=No+Image
35566,Stoneground Cinnamon Cluster Cereal Flakes,Quality stoneground cinnamon cluster cereal flakes - fresh grocery product,5.01,https://via.placeholder.com/300x300?text=No+Image
35568,Soft Baked Granola,Cranberry almond soft baked whole grain granola,7.1,https://via.placeholder.com/300x300?text=No+Image
35572,Blueberry Walnut Granola,Blueberry walnut soft baked whole grain granola,9.73,https://via.placeholder.com/300x300?text=No+Image
35594,Organic Hemp Plus Granola Cereal,Quality organic hemp plus granola cereal - fresh grocery product,12.62,https://via.placeholder.com/300x300?text=No+Image
35619,Corn Chex Cereal,Chex cereal gluten free corn,8.29,https://images.openfoodfacts.org/images/products/001/600/048/7963/front_en.12.400.jpg
35688,Cocoa Bunnies Whole Grain Cereal,Quality cocoa bunnies whole grain cereal - fresh grocery product,11.77,https://via.placeholder.com/300x300?text=No+Image
35694,Sweet Potato Pancake & Waffle Mix,"Arrowhead mills, pancake & waffle mix, sweet potato",5.1,https://via.placeholder.com/300x300?text=No+Image
35695,Maple & Brown Sugar Instant Oatmeal,"Instant oatmeal with maple, brown sugar, and protein",6.98,https://images.openfoodfacts.org/images/products/070/559/901/4147/front_en.34.400.jpg
35724,Honey Nut Crunch Cereal,Honey nut crunch,10.72,https://images.openfoodfacts.org/images/products/505/244/916/8044/front_en.12.400.jpg
35743,Golean Crisp! Cinnamon Crumble Cereal,Quality golean crisp! cinnamon crumble cereal - fresh grocery product,11.27,https://via.placeholder.com/300x300?text=No+Image
35754,Vanilla Cherry Pecan Muesli,"Minne Muesli, Vanilla Cherry Pecan",4.67,https://via.placeholder.com/300x300?text=No+Image
35786,"Raisin, Date & Walnut Instant Oatmeal","Instant oatmeal with raisins, dates, and walnuts",11.69,https://images.openfoodfacts.org/images/products/003/000/056/7340/front_en.15.400.jpg
35843,Gluten Free Quinoa Rice & Shine Hot Cereal,Quinoa Rice & Shine Hot Cereal,2.07,https://images.openfoodfacts.org/images/products/007/433/337/4305/front_en.4.400.jpg
35893,"Organic Cherry, Chia, and Vanilla Granola","Quality organic cherry, chia, and vanilla granola - fresh grocery product",14.49,https://via.placeholder.com/300x300?text=No+Image
35901,Extra Light & Fluffy Pancake & Waffle Mix,Extra Light & Fluffy Pancake and Waffle Mix,6.67,https://images.openfoodfacts.org/images/products/001/330/028/0676/front_en.27.400.jpg
36097,"Cereal, Superfood, Cacao Crunch",Organic Cacao Crunch Superfood Cereal,6.56,https://via.placeholder.com/300x300?text=No+Image
36148,Organic Oat Bran Flakes,Multigrain oat bran flakes cereal,10.96,https://images.openfoodfacts.org/images/products/005/844/960/2316/front_en.20.400.jpg
36267,Gluten Free Cinnamon Heaven Cereal,Quality gluten free cinnamon heaven cereal - fresh grocery product,12.93,https://via.placeholder.com/300x300?text=No+Image
36288,Low Fat Vanilla Cereal,Vanilla Non Dairy Rice Beverage,2.28,https://images.openfoodfacts.org/images/products/085/003/203/3008/front_en.13.400.jpg
36294,Paleo Granola,Low Sugar Granola,6.64,https://images.openfoodfacts.org/images/products/506/037/530/0162/front_en.17.400.jpg
36362,"Baked Crackers, Cheddar Cheese","Goldfish Baked Snack Crackers, Cheddar",3.33,https://images.openfoodfacts.org/images/products/001/410/005/0544/front_en.22.400.jpg
36373,Gluten Free Chocolate Chip Pancake Mix,Quality gluten free chocolate chip pancake mix - fresh grocery product,6.31,https://via.placeholder.com/300x300?text=No+Image
36374,Vanilla Pecan Granola,"100% Natural Granola With Vanilla, Almonds & Pecans",5.86,https://via.placeholder.com/300x300?text=No+Image
36428,Organic Promise Cranberry Spelt & Flax Granola,Quality organic promise cranberry spelt & flax granola - fresh grocery product,10.34,https://via.placeholder.com/300x300?text=No+Image
36472,Nutri Grain Bars Multi Pack,Quality nutri grain bars multi pack - fresh grocery product,14.15,https://via.placeholder.com/300x300?text=No+Image
36481,Organic Gluten Free Maple Buckwheat Flakes,Organic Maple Buckwheat Flakes Gluten Free,11.7,https://images.openfoodfacts.org/images/products/007/433/337/4701/front_en.13.400.jpg
36584,Renola Berry Fruit Nut & Seed Mix,"Larabar, fruit nut & seed mix, renola berry",9.31,https://via.placeholder.com/300x300?text=No+Image
36586,Veganic Sprouted Ancient Grain O's,Veganic sprouted ancient grain o's,5.72,https://via.placeholder.com/300x300?text=No+Image
36612,Original Wheat Berry Flakes,Original Wheat Berry Flakes,9.77,https://images.openfoodfacts.org/images/products/004/165/345/6783/front_en.16.400.jpg
36723,Oat Bran Hot Cereal,High fiber oat bran hot cereal,4.97,https://via.placeholder.com/300x300?text=No+Image
36769,"Granola, Organic, Original",Cereals mix,2.49,https://images.openfoodfacts.org/images/products/085/514/000/2175/front_en.13.400.jpg
36810,Original Pancake and Baking Mix,Bisquick Original Pancake and Baking Mix,6.22,https://images.openfoodfacts.org/images/products/001/600/042/0403/front_en.14.400.jpg
36832,"Yellow Corn Grits, Organic",Grits organic yellow corn,1.46,https://via.placeholder.com/300x300?text=No+Image
36848,Gluten Free Quick Cooking Oats,Quick Cooking Rolled Oats whole grain Gluten Free,11.08,https://images.openfoodfacts.org/images/products/003/997/803/3765/front_en.33.400.jpg
36893,Irish Steel Cut Oatmeal,Steel cut oats,3.27,https://images.openfoodfacts.org/images/products/007/246/300/0200/front_en.25.400.jpg
36911,Cranberry Granola Fruit Clusters,"Ocean spray, craisins, dried cranberries fruit cluster, cranberry granola",3.19,https://via.placeholder.com/300x300?text=No+Image
36952,Granola Cereal,Super Seedy & Nutty Granola,7.79,https://images.openfoodfacts.org/images/products/507/000/012/6579/front_en.17.400.jpg
36994,Organic Graham Crunch Cereal,Quality organic graham crunch cereal - fresh grocery product,14.34,https://via.placeholder.com/300x300?text=No+Image
37123,Organic Promise Sprouted Grains Cereal,Kashi Organic Cereal Promise Sprouted Grain 9.5oz,6.92,https://images.openfoodfacts.org/images/products/001/862/710/2724/front_fr.3.400.jpg
37171,Special K Chocolatey Caramel Pastry Crisps,Quality special k chocolatey caramel pastry crisps - fresh grocery product,13.77,https://via.placeholder.com/300x300?text=No+Image
37230,"Cereal, TropicO's",barra energética de amaranto con almendras amazónicas y uva pasas.,9.85,https://images.openfoodfacts.org/images/products/777/960/403/0067/front_es.4.400.jpg
37235,Sprout & Shine Cereal,"Back to nature, sprout & shine brown rice crisps",8.39,https://via.placeholder.com/300x300?text=No+Image
37262,Original Bran Cereal,All-Bran Original,6.09,https://images.openfoodfacts.org/images/products/500/012/714/2190/front_en.17.400.jpg
37295,Bite Size Frosted Shredded Wheat,Frosted shredded bite size wheats,1.46,https://images.openfoodfacts.org/images/products/000/000/018/0245/front_en.23.400.jpg
37405,Frosted Mini-Wheats Little Bites Chocolate Cereal,"Frosted Mini-Wheats, Little Bites, Lightly Sweetened Whole Grain Cereal, Chocolate, Chocolate",8.03,https://via.placeholder.com/300x300?text=No+Image
37426,Toaster Strudel Danish Style Cream Cheese Toaster Pastries,Pillsbury Danish Style Cream Cheese Toaster Strudel Pastries 6 Count,3.09,https://via.placeholder.com/300x300?text=No+Image
37464,Apple Cinnamon Instant Oatmeal,"instant oatmeal (apples & cinnamon flavor, maple & brown sugar flavor, cinnamon & spice flavor).",3.94,https://images.openfoodfacts.org/images/products/003/000/056/9757/front_en.31.400.jpg
37526,Swiss Muesli Original Recipe All Natural,Quality swiss muesli original recipe all natural - fresh grocery product,2.21,https://via.placeholder.com/300x300?text=No+Image
37776,Vanilla All Natural Liquid Coffee Creamer,Quality vanilla all natural liquid coffee creamer - fresh grocery product,5.55,https://via.placeholder.com/300x300?text=No+Image
37787,Granola Chocolate Elation,Quality granola chocolate elation - fresh grocery product,11.74,https://via.placeholder.com/300x300?text=No+Image
37854,Berry Medley Oatmeal,Quaker Real Medleys Summer Berry Oatmeal 2.46 Ounce Cup,10.08,https://images.openfoodfacts.org/images/products/003/000/031/5521/front_en.3.400.jpg
37869,Breakfast Essentials® Classic French Vanilla Powder Drink Mix,Quality breakfast essentials® classic french vanilla powder drink mix - fresh grocery product,2.78,https://via.placeholder.com/300x300?text=No+Image
37955,Homestyle Oatmeal Raisin Granola,Quality homestyle oatmeal raisin granola - fresh grocery product,7.78,https://via.placeholder.com/300x300?text=No+Image
38034,Gluten Free Cherry Breakfast Bars,Quality gluten free cherry breakfast bars - fresh grocery product,13.05,https://via.placeholder.com/300x300?text=No+Image
38039,Smart Bran With Psyllium & Oatbran Cereal,Quality smart bran with psyllium & oatbran cereal - fresh grocery product,10.19,https://via.placeholder.com/300x300?text=No+Image
38063,Cocoa Puffs Cereal,chocolate flavored frosted corn puffs,2.23,https://images.openfoodfacts.org/images/products/001/600/016/9395/front_en.18.400.jpg
38073,Organic Honey Hemp Sprouted Oat Granola,Gluten Free Honey Hemp Sprouted Oat Granola,3.67,https://images.openfoodfacts.org/images/products/067/562/536/0060/front_en.5.400.jpg
38110,Organic Promise Indigo Morning Cereal,Quality organic promise indigo morning cereal - fresh grocery product,9.18,https://via.placeholder.com/300x300?text=No+Image
38180,Organic Chia Sprouted Oat Vanilla Granola,Quality organic chia sprouted oat vanilla granola - fresh grocery product,8.02,https://via.placeholder.com/300x300?text=No+Image
38199,Blueberry Pancake and Waffle Mix,"Blueberry complete pancake & waffle mix, blueberry",14.92,https://via.placeholder.com/300x300?text=No+Image
38217,Snackimals Vanilla Blast Cereal,Quality snackimals vanilla blast cereal - fresh grocery product,10.59,https://via.placeholder.com/300x300?text=No+Image
38281,Organic Extra Thick Rolled Oats,Gluten Free Organic Extra Thick Rolled Oats,4.6,https://images.openfoodfacts.org/images/products/003/997/801/3866/front_en.20.400.jpg
38318,Original Flavor Instant Oatmeal,Original Oats Instant Oatmeal,2.53,https://images.openfoodfacts.org/images/products/001/111/010/0283/front_en.3.400.jpg
38328,Organic Protein Dark Chocolate Coconut Granola,Quality organic protein dark chocolate coconut granola - fresh grocery product,5.66,https://via.placeholder.com/300x300?text=No+Image
38436,Dark Chocolate Cranberry Granola,"Dark chocolate cranberry almond granola clusters with cranberries, almonds, and dark chocolate, dark chocolate cranberry almond",2.23,https://via.placeholder.com/300x300?text=No+Image
38574,Love Crunch Aloha Blend Granola,Quality love crunch aloha blend granola - fresh grocery product,1.76,https://via.placeholder.com/300x300?text=No+Image
38682,Gluten Free Instant Oatmeal Strawberry Shortcake Flavor,Quality gluten free instant oatmeal strawberry shortcake flavor - fresh grocery product,8.8,https://via.placeholder.com/300x300?text=No+Image
38791,Organic Buttermilk Pancake Mix,Organic Buttermilk Pancake & Waffle Mix,9.87,https://images.openfoodfacts.org/images/products/081/000/156/0522/front_en.35.400.jpg
38801,Oat Clusters Toasted Granola Raisin Almond Crunch,Quality oat clusters toasted granola raisin almond crunch - fresh grocery product,9.54,https://via.placeholder.com/300x300?text=No+Image
38826,Blueberry Soft-Baked Oatmeal Squares,Quality blueberry soft-baked oatmeal squares - fresh grocery product,11.89,https://via.placeholder.com/300x300?text=No+Image
38834,Organic Razzi Raspberry Frosted Toaster Pastries 6 Count,Quality organic razzi raspberry frosted toaster pastries 6 count - fresh grocery product,6.06,https://via.placeholder.com/300x300?text=No+Image
38838,Purely O's Organic Cereal,Cereals mix,8.46,https://images.openfoodfacts.org/images/products/085/514/000/2175/front_en.13.400.jpg
38875,Gluten Free Pancake Mix,Gluten Free Pancake Mix,4.6,https://images.openfoodfacts.org/images/products/003/997/811/4624/front_en.22.400.jpg
38937,Original Instant Oatmeal Hot Cereal,Quality original instant oatmeal hot cereal - fresh grocery product,5.93,https://via.placeholder.com/300x300?text=No+Image
38953,Original Hot Wheat Cereal,Hot wheat cereal,7.26,https://images.openfoodfacts.org/images/products/001/313/000/6125/front_en.32.400.jpg
39020,Original Original Honest O's Cereal,"Organic original honest o's cereal, original",2.82,https://via.placeholder.com/300x300?text=No+Image
39073,Whole Wheat Buttermilk Pancake Mix,"Whole wheat buttermilk pancake & waffle mix, whole wheat buttermilk",6.69,https://images.openfoodfacts.org/images/products/009/948/242/4534/front_en.3.400.jpg
39089,Natural Puffed Wheat Cereal,Quality natural puffed wheat cereal - fresh grocery product,13.09,https://via.placeholder.com/300x300?text=No+Image
39112,Organic Scottish Oatmeal,Organic scottish oatmeal,9.48,https://images.openfoodfacts.org/images/products/003/997/802/9560/front_en.12.400.jpg
39116,Ginger Snap Granola,"Giant eagle, nature's basket, ginger snap granola",3.31,https://via.placeholder.com/300x300?text=No+Image
39142,Old Fashioned Oats,Scott's Old Fashioned Porridge 1Kg,14.05,https://images.openfoodfacts.org/images/products/500/010/802/2190/front_en.4.400.jpg
39166,Organic Puffed Kamut Cereal,Organic Puffed Kamut,14.82,https://images.openfoodfacts.org/images/products/007/433/347/4340/front_en.4.400.jpg
39174,Honey Nut Cheerios Medley Crunch Cereal,Honey Nut Cheerios Medley Crunch,10.76,https://images.openfoodfacts.org/images/products/001/600/016/3454/front_en.3.400.jpg
39216,Original Multigrain Spoonfuls Cereal,Multigrain Spoonfuls Original,5.13,https://images.openfoodfacts.org/images/products/007/061/720/6072/front_en.7.400.jpg
39317,WellBars With Crunchy Peanuts & Honey,Quality wellbars with crunchy peanuts & honey - fresh grocery product,4.42,https://via.placeholder.com/300x300?text=No+Image
39370,Honey Peanut Butter Hot Oatmeal Bowl,Quality honey peanut butter hot oatmeal bowl - fresh grocery product,11.08,https://via.placeholder.com/300x300?text=No+Image
39411,Organic Cinnamon Harvest Cereal,Organic Cinnamon Harvest,7.46,https://images.openfoodfacts.org/images/products/001/862/770/3174/front_en.25.400.jpg
39441,"Instant, Irish Oatmeal, Maple & Brown Sugar",Maple & Brown Sugar Instant Irish Oatmeal,2.61,https://images.openfoodfacts.org/images/products/007/246/300/0248/front_en.5.400.jpg
39443,Organic Multigrain Apple Cobbler Cereal Bars,"Health valley organic, multigrain cereal bars, apple cobbler",1.89,https://via.placeholder.com/300x300?text=No+Image
39473,"Gluten Free Granola, Extreme Fruit and Nut, Family Value Size","Quality gluten free granola, extreme fruit and nut, family value size - fresh grocery product",2.8,https://via.placeholder.com/300x300?text=No+Image
39488,Enriched Bran Flakes Cereal,"Kiggins, Enriched Whole Grain Wheat & Bran Flakes Cereal",5.33,https://via.placeholder.com/300x300?text=No+Image
39496,"Variety Pack - Chocolate Chunk, Peanut Butter Chocolate Chip, S'mores Granola Bars","Quality variety pack - chocolate chunk, peanut butter chocolate chip, s'mores granola bars - fresh grocery product",2.31,https://via.placeholder.com/300x300?text=No+Image
39507,Pop-Tarts Unfrosted Strawberry,Quality pop-tarts unfrosted strawberry - fresh grocery product,7.93,https://via.placeholder.com/300x300?text=No+Image
39550,Berry Vanilla Puffs,Organic Berry Vanilla Puffs,2.4,https://images.openfoodfacts.org/images/products/002/190/845/0148/front_en.3.400.jpg
39560,Go Lean Crunch! Honey Almond Flax Cereal,GO Lean Honey Almond Flax Crunch,13.63,https://images.openfoodfacts.org/images/products/001/862/770/3396/front_en.40.400.jpg
39598,"Granola, Artisan, Cranberry","Quality granola, artisan, cranberry - fresh grocery product",12.44,https://via.placeholder.com/300x300?text=No+Image
39807,Ancient Grain Oatmeal Cranberry Pumpkin Seed,Quality ancient grain oatmeal cranberry pumpkin seed - fresh grocery product,6.26,https://via.placeholder.com/300x300?text=No+Image
39832,Rise Krisipies Toasted Rice Cereal,Quality rise krisipies toasted rice cereal - fresh grocery product,5.84,https://via.placeholder.com/300x300?text=No+Image
39854,Fruteria Chewy Mango Strawberry Chewy Granola Bars,"Nature Valley, Fruteria, Chewy Granola Bars, Mango Strawberry, Mango Strawberry",8.32,https://via.placeholder.com/300x300?text=No+Image
39861,Flax Plus Hot Oatmeal,Quality flax plus hot oatmeal - fresh grocery product,6.62,https://via.placeholder.com/300x300?text=No+Image
39885,Vanilla Cranberry Granola,Vanilla yogurt with coconut cranberry granola,3.53,https://images.openfoodfacts.org/images/products/506/024/820/8274/front_en.6.400.jpg
39915,Real Medleys Supergrains Blueberry Pecan With Other Natural Flavor,Quality real medleys supergrains blueberry pecan with other natural flavor - fresh grocery product,6.42,https://via.placeholder.com/300x300?text=No+Image
39960,Golden Raisin Cinnamon Breakfast Bars,Quality golden raisin cinnamon breakfast bars - fresh grocery product,9.69,https://via.placeholder.com/300x300?text=No+Image
40000,Select Starts Cranberry Almond Instant Oatmeal,Quality select starts cranberry almond instant oatmeal - fresh grocery product,4.84,https://via.placeholder.com/300x300?text=No+Image
40021,Kix Crispy Corn Puffs Cereal,Crispy Corn Puffs,13.6,https://via.placeholder.com/300x300?text=No+Image
40062,Original Golden Grahams,Quality original golden grahams - fresh grocery product,6.28,https://via.placeholder.com/300x300?text=No+Image
40123,"Hot Cereal, Instant, Quinoa & Oat",Organic Quinoa & Oat Instant Hot Cereal,8.43,https://via.placeholder.com/300x300?text=No+Image
40148,Organic Ancient Grains Crispbread,100% Organic Ancient Grains Crispbread,4.37,https://images.openfoodfacts.org/images/products/084/820/606/9717/front_en.3.400.jpg
40212,Honey Oat Clusters,Honey Bunches of Oats,4.58,https://images.openfoodfacts.org/images/products/088/491/235/6321/front_en.3.400.jpg
40214,90 Calorie Chocolate Fudge Brownies,90 CALORIE Chocolate Fudge Brownie,10.56,https://images.openfoodfacts.org/images/products/841/007/691/0820/front_en.3.400.jpg
40237,Gluten Free Original Oatmeal,Gluten Free Instant Original Oatmeal,13.09,https://images.openfoodfacts.org/images/products/003/000/031/7983/front_en.12.400.jpg
40254,Protein Oats & Honey Cheerios,Cheerios Protein Oats and Honey Cereal,1.82,https://images.openfoodfacts.org/images/products/001/600/045/1377/front_de.14.400.jpg
40278,Special K Original,Plain bagels,4.81,https://images.openfoodfacts.org/images/products/502/036/401/0113/front_en.66.400.jpg
40289,Organic Flax Plus Multibran Flakes Cereal,Flax Plus Multibran Flakes Cereal,12.05,https://images.openfoodfacts.org/images/products/005/844/977/0503/front_en.35.400.jpg
40344,All-Bran Complete Wheat Flakes Cereal,All-Bran Complete Wheat Flakes,9.52,https://images.openfoodfacts.org/images/products/003/800/059/6674/front_en.7.400.jpg
40407,Honey Wheat Complete Pancake Mix,"Honey wheat light & fluffy complete pancake mix, honey wheat",2.92,https://via.placeholder.com/300x300?text=No+Image
40427,Organic Gluten Free Crispy Brown Rice Cereal,Quality organic gluten free crispy brown rice cereal - fresh grocery product,6.29,https://via.placeholder.com/300x300?text=No+Image
40451,Breakfast Pack,So Simple Original Family Pack Porridge,14.48,https://images.openfoodfacts.org/images/products/500/010/867/5495/front_en.22.400.jpg
40495,Honey Nut Tasteeos,"Roundy's, honey nut tasteeos, sweetened toasted oat cereal, almond",8.45,https://via.placeholder.com/300x300?text=No+Image
40554,Oat Blueberry Lemon Whenever Bars,Quality oat blueberry lemon whenever bars - fresh grocery product,4.85,https://via.placeholder.com/300x300?text=No+Image
40568,Paleo Pancake & Waffle Mix,Paleo Pancake & Waffle Mix imp,4.15,https://images.openfoodfacts.org/images/products/085/601/700/3448/front_en.16.400.jpg
40574,Rice Cereal,Organic lightly salted wholegrain rice cakes,5.4,https://images.openfoodfacts.org/images/products/501/366/510/0065/front_en.52.400.jpg
40721,Organic Creamy Buckwheat Hot Cereal Gluten Free,Quality organic creamy buckwheat hot cereal gluten free - fresh grocery product,8.71,https://via.placeholder.com/300x300?text=No+Image
40785,Hemp Plus Granola,Hemp Hearts Granola,4.68,https://images.openfoodfacts.org/images/products/005/844/989/0171/front_fr.9.400.jpg
40935,Special K Cinnamon Pecan Cereal,"Kellogg's, special k nourish, multi grain blend with quinoa hot ceral, cinnamon raisin pecan",11.05,https://via.placeholder.com/300x300?text=No+Image
41012,Pro-Teen Crunch Cereal,Pro-Teen Crunch,8.51,https://via.placeholder.com/300x300?text=No+Image
41020,Farina Hot Cereal,Farina Original Hot Cereal,8.19,https://images.openfoodfacts.org/images/products/004/240/013/7320/front_en.14.400.jpg
41029,Vanilla Artisan Granola,"Udi's, artisan granola, vanilla and almond",2.16,https://via.placeholder.com/300x300?text=No+Image
41057,Soft-Baked Ripe Strawberry Cereal Bars,Quality soft-baked ripe strawberry cereal bars - fresh grocery product,11.46,https://via.placeholder.com/300x300?text=No+Image
41083,Gluten Free Wheat Free Pancake & Waffle Mix,Quality gluten free wheat free pancake & waffle mix - fresh grocery product,3.84,https://via.placeholder.com/300x300?text=No+Image
41085,Warm & Crunchy Apple Cinnamon Granola,Quaker Warm Crunchy Granola Apple Cinnamon (8 - 1.69 Ounce) 13.52 Ounce 8 Pack Packet,4.86,https://via.placeholder.com/300x300?text=No+Image
41097,Quick 1-Minute Oats,Rolled oats,4.25,https://images.openfoodfacts.org/images/products/003/000/001/2000/front_en.76.400.jpg
41121,Superfood Cereal Maca Double Chocolate,Maca Double Chocolate Superfood Cereal,8.89,https://via.placeholder.com/300x300?text=No+Image
41173,Honey Oat Clusters Cereal,Honey Bunches of Oats,5.42,https://images.openfoodfacts.org/images/products/088/491/235/6321/front_en.3.400.jpg
41226,Shredded Wheat Bite Size Cereal,Bite Size Shredded Wheat,5.65,https://images.openfoodfacts.org/images/products/007/874/203/0920/front_en.5.400.jpg
41237,Raspberry Coconut Oatmeal Fruit Squeeze,"Raspberry coconut oatmeal fruit squeeze, raspberry coconut",5.98,https://via.placeholder.com/300x300?text=No+Image
41243,Fruit Juice Sweetened Millet Rice Cereal,"Nature's path, fruit juice sweetened millet rice cereal with oatbran",7.02,https://images.openfoodfacts.org/images/products/005/844/977/0077/front_en.5.400.jpg
41315,Organic Handmade Granola,Made with organic,9.4,https://via.placeholder.com/300x300?text=No+Image
41332,Organic Recipe Granola,Quality organic recipe granola - fresh grocery product,2.72,https://via.placeholder.com/300x300?text=No+Image
41351,Family Size Naturally Flavored Whole Grain Oats Cereal,Quality family size naturally flavored whole grain oats cereal - fresh grocery product,10.43,https://via.placeholder.com/300x300?text=No+Image
41360,Maple-icious Pecan Soft Baked Granola,Quality maple-icious pecan soft baked granola - fresh grocery product,2.97,https://via.placeholder.com/300x300?text=No+Image
41367,Frosted Mini-Wheats Blueberry Cereal,Quality frosted mini-wheats blueberry cereal - fresh grocery product,11.63,https://via.placeholder.com/300x300?text=No+Image
41381,Quaker Real Medleys Peach Apple Walnut Multigrain Cereal,Quality quaker real medleys peach apple walnut multigrain cereal - fresh grocery product,13.69,https://via.placeholder.com/300x300?text=No+Image
41476,Gluten Free Honey Nut Granola Mix,Quality gluten free honey nut granola mix - fresh grocery product,12.53,https://via.placeholder.com/300x300?text=No+Image
41548,Mango Peach Passion Cereal,"Peace cereal, low fat clusters & flakes, mango peach passion",3.79,https://via.placeholder.com/300x300?text=No+Image
41589,Chocolate Oat Clusters,yogurt & oats crunchy clusters chocolate,13.25,https://images.openfoodfacts.org/images/products/539/111/500/0821/front_en.23.400.jpg
41623,Organic High Fiber Oat Bran Hot Cereal,High fiber oat bran hot cereal organic,3.79,https://images.openfoodfacts.org/images/products/000/003/635/9554/front_en.3.400.jpg
41644,Multigrain Oatbran Cereal,"Nature's path, multigrain oatbran cereal",1.56,https://via.placeholder.com/300x300?text=No+Image
41668,Steel Cut with Protein Maple & Brown Sugar Oatmeal,Quality steel cut with protein maple & brown sugar oatmeal - fresh grocery product,3.13,https://via.placeholder.com/300x300?text=No+Image
41687,Honey Puffs Cereal,honey spelt puffs,7.16,https://images.openfoodfacts.org/images/products/506/012/028/3122/front_en.26.400.jpg
41746,Instant Oatmeal Weight Control Variety,Quaker Select Starts Weight Control Instant Oatmeal Variety Pack (8 - 1.58 oz) 12.6 Ounce 8 Pack Packets,13.9,https://images.openfoodfacts.org/images/products/003/000/026/9664/front_es.3.400.jpg
41824,Instant Oatmeal Original,Original Instant Oatmeal imp,6.86,https://images.openfoodfacts.org/images/products/003/000/056/7319/front_en.3.400.jpg
41826,Soft and Chewy Coconut Cashew Granola,Quality soft and chewy coconut cashew granola - fresh grocery product,5.26,https://via.placeholder.com/300x300?text=No+Image
41844,Honey Nut Cheerios,Honey Nut Cheerios,4.57,https://images.openfoodfacts.org/images/products/001/600/012/4790/front_en.62.400.jpg
41890,Organic Mesa Sunrise Cereal,"Mesa Sunrise Cereal, Organic",4.97,https://images.openfoodfacts.org/images/products/005/844/977/9018/front_en.101.400.jpg
41949,Heritage O's Multigrain Cereal,Quality heritage o's multigrain cereal - fresh grocery product,7.32,https://via.placeholder.com/300x300?text=No+Image
