product_id,product_name,description,price,image_url
49,Vegetarian Grain Meat Sausages Italian - 4 CT,Quality vegetarian grain meat sausages italian - 4 ct - fresh grocery product,3.54,https://via.placeholder.com/300x300?text=No+Image
62,Premium Deli Oven Roasted Turkey Breast,Oven Roasted Premium Deli Turkey Breast,11.07,https://via.placeholder.com/300x300?text=No+Image
74,Artisan Chick'n & Apple Sausage,Quality artisan chick'n & apple sausage - fresh grocery product,2.83,https://via.placeholder.com/300x300?text=No+Image
85,Soppressata Piccante,Soppressata piccante,8.2,https://via.placeholder.com/300x300?text=No+Image
109,Grape Leaf Hummus Wrap,Quality grape leaf hummus wrap - fresh grocery product,2.45,https://via.placeholder.com/300x300?text=No+Image
138,Olli Napoli Salami,Quality olli napoli salami - fresh grocery product,14.59,https://via.placeholder.com/300x300?text=No+Image
147,Organic Ranch Veggie Dip,"Organic ranch! veggie dip, ranch",5.13,https://via.placeholder.com/300x300?text=No+Image
158,Smoked Ham & Oven Roasted Turkey Sub Sandwich Kit,"Smoked ham & water product 40% of weight is added ingredients a portion of ground ham added: ham cured with water, dextrose, salt. less than 2% of sodium phosphates, modified corn starch, flavorings, ",2.62,https://via.placeholder.com/300x300?text=No+Image
176,Original Turkey,Original seasoned grilled turkey burger,4.06,https://images.openfoodfacts.org/images/products/002/265/572/3981/front_en.35.400.jpg
188,Mild El Nino Salsa,Quality mild el nino salsa - fresh grocery product,14.12,https://via.placeholder.com/300x300?text=No+Image
198,Tzatziki Cucumber Sauce,Tzatziki Creamy Garlic Cucumber Dip,3.48,https://images.openfoodfacts.org/images/products/000/000/020/4057/front_en.32.400.jpg
209,Italian Pasta Salad,Lunch on the Go Italian Style Tuna Salad,11.32,https://images.openfoodfacts.org/images/products/500/017/105/4449/front_en.6.400.jpg
287,Turkey,Haselnusskerne geröstet,8.72,https://images.openfoodfacts.org/images/products/405/648/903/3042/front_en.74.400.jpg
353,Tzatziki Greek Yogurt Dip,Tzatziki Greek Style Yogurt Dip,12.16,https://images.openfoodfacts.org/images/products/076/818/300/0469/front_en.30.400.jpg
359,Deli Thin-Sliced Honey Ham,Quality deli thin-sliced honey ham - fresh grocery product,3.85,https://via.placeholder.com/300x300?text=No+Image
374,Sliced Kosher Salami,Sliced kosher salami made with chicken & beef,14.53,https://via.placeholder.com/300x300?text=No+Image
403,Ultra Thin Pastrami,HLLSHIRE FARM PASTRAMI ULTRA THIN,4.9,https://images.openfoodfacts.org/images/products/004/450/098/4705/front_en.7.400.jpg
453,Hummus Wrap,Wrap Falafel Mit Hummus,2.85,https://images.openfoodfacts.org/images/products/000/002/217/3836/front_fr.4.400.jpg
544,Classic Original Hummus,Original Hummus,12.94,https://images.openfoodfacts.org/images/products/506/050/431/0918/front_en.3.400.jpg
554,Turkey Chili,Chili Turkey With Beans,6.8,https://images.openfoodfacts.org/images/products/003/760/010/7433/front_en.20.400.jpg
611,Uncured Hard Salami,"Natural choice, uncured hard salami",4.37,https://images.openfoodfacts.org/images/products/003/760/073/5803/front_en.6.400.jpg
616,Silken Tofu,yutaka silken tofu imp,11.54,https://images.openfoodfacts.org/images/products/501/427/670/1221/front_en.59.400.jpg
663,Pico De Gallo,Pico de Gallo White CornTortilla Chips,10.5,https://images.openfoodfacts.org/images/products/085/440/100/4002/front_en.4.400.jpg
687,Cocktail Time Hummus,Quality cocktail time hummus - fresh grocery product,5.87,https://via.placeholder.com/300x300?text=No+Image
731,Wild Mushroom Vegetarian Quarter Loaf,Quality wild mushroom vegetarian quarter loaf - fresh grocery product,7.61,https://via.placeholder.com/300x300?text=No+Image
734,Salame All Natural Uncured Pepperoni,Quality salame all natural uncured pepperoni - fresh grocery product,13.99,https://via.placeholder.com/300x300?text=No+Image
757,Premium Deli Hard Salami,Quality premium deli hard salami - fresh grocery product,14.01,https://via.placeholder.com/300x300?text=No+Image
809,Bolani Pumpkin Filled Flatbread,Pumpkin Filled Flatbread,7.61,https://images.openfoodfacts.org/images/products/085/003/271/6062/front_en.3.400.jpg
885,Lunchmakers Pizza Pepperoni with Nestle Crunch Bar,Quality lunchmakers pizza pepperoni with nestle crunch bar - fresh grocery product,3.85,https://via.placeholder.com/300x300?text=No+Image
886,Whole Grain Salad with Roasted Pecans & Mango Vinaigrette,Quality whole grain salad with roasted pecans & mango vinaigrette - fresh grocery product,3.15,https://via.placeholder.com/300x300?text=No+Image
904,"Tofu, Gluten Free, Garlic Pepper","Quality tofu, gluten free, garlic pepper - fresh grocery product",9.66,https://via.placeholder.com/300x300?text=No+Image
947,Cracker Crunchers Bologna with Nestle Butterfinger Bar LunchMakers,Quality cracker crunchers bologna with nestle butterfinger bar lunchmakers - fresh grocery product,8.08,https://via.placeholder.com/300x300?text=No+Image
961,Grape Sunflower Butter Sunwiches,Quality grape sunflower butter sunwiches - fresh grocery product,11.6,https://via.placeholder.com/300x300?text=No+Image
990,Diced Pancetta,"Diced, cured and dried pork belly",8.31,https://images.openfoodfacts.org/images/products/000/000/151/0225/front_en.23.400.jpg
1057,"Basil, Asiago & Pine Nut Pesto Ravioli","Quality basil, asiago & pine nut pesto ravioli - fresh grocery product",3.85,https://via.placeholder.com/300x300?text=No+Image
1068,Pork & Duck Live Mousse With Port Wine Topped With Aspic,Quality pork & duck live mousse with port wine topped with aspic - fresh grocery product,5.69,https://via.placeholder.com/300x300?text=No+Image
1073,Carving Board Oven Roasted Turkey,Quality carving board oven roasted turkey - fresh grocery product,11.3,https://via.placeholder.com/300x300?text=No+Image
1074,German Bologna,"Wunderbar, german brand, bologna, made with pork, chicken, beef",10.9,https://via.placeholder.com/300x300?text=No+Image
1103,Hickory Smoked Turkey Breast,"Land o'frost, premium, hickory smoked turkey breast",8.92,https://images.openfoodfacts.org/images/products/005/190/001/6080/front_en.13.400.jpg
1108,Hummus Roasted Garlic,Roasted Garlic Hummus,8.27,https://images.openfoodfacts.org/images/products/004/082/201/1242/front_en.28.400.jpg
1115,Turkey Bologna,Thick Sliced Turkey Bologna,9.5,https://via.placeholder.com/300x300?text=No+Image
1150,"AFC Sushi Spicy Salmon Roll Prepared In Store, Ready To Eat","Quality afc sushi spicy salmon roll prepared in store, ready to eat - fresh grocery product",11.82,https://via.placeholder.com/300x300?text=No+Image
1180,Mesquite Uncured Salame,"Aidells, mesquite uncured salame",3.53,https://via.placeholder.com/300x300?text=No+Image
1250,Turkey Breast Oven Roasted,"Oven roasted turkey breast, oven roasted",14.72,https://images.openfoodfacts.org/images/products/002/531/758/6009/front_en.28.400.jpg
1392,Medium Salsa Organica,Orgánica Salsa Medium,13.36,https://images.openfoodfacts.org/images/products/009/661/911/1121/front_en.19.400.jpg
1394,Uncured Pepperoni Slices,H-e-b select uncured pepperoni fresh slice,1.7,https://via.placeholder.com/300x300?text=No+Image
1411,"Hummus, Roasted Garlic",Roasted Garlic Hummus,8.22,https://images.openfoodfacts.org/images/products/004/082/201/1242/front_en.28.400.jpg
1455,Firm Pesto Tofu,Quality firm pesto tofu - fresh grocery product,7.54,https://via.placeholder.com/300x300?text=No+Image
1479,Jalapeno Dip,Jalapeno Houmous,10.6,https://images.openfoodfacts.org/images/products/506/022/832/3980/front_en.15.400.jpg
1558,Beef Empanadas,Empanadas beef,13.93,https://images.openfoodfacts.org/images/products/871/871/917/6009/front_en.3.400.jpg
1566,Forty Spices Hummus,"Tribe, Forty Spices Hummus",9.4,https://via.placeholder.com/300x300?text=No+Image
1569,Cold Shredded Chicken,Quality cold shredded chicken - fresh grocery product,13.42,https://via.placeholder.com/300x300?text=No+Image
1582,Turkey Pepperoni Slices,Turkey pepperoni slices,1.32,https://via.placeholder.com/300x300?text=No+Image
1600,Mediterranean Orzo Salad,Mediterranean style orzo pasta salad,3.19,https://images.openfoodfacts.org/images/products/000/000/061/3026/front_en.3.400.jpg
1645,Creamed Corn,Creamed corn,13.13,https://images.openfoodfacts.org/images/products/931/008/215/8010/front_en.5.400.jpg
1646,Smoked Ham Style Deli Slices,Plant-based Deli Slices Smoked Ham style,7.1,https://images.openfoodfacts.org/images/products/002/558/300/7222/front_en.18.400.jpg
1698,Chick Pea Salad,Chick Pea Salad,6.94,https://images.openfoodfacts.org/images/products/008/151/182/9151/front_sv.3.400.jpg
1795,Hot Roasted Green Salsa,Quality hot roasted green salsa - fresh grocery product,9.75,https://via.placeholder.com/300x300?text=No+Image
1922,Organic Super Hemp Hummus,Quality organic super hemp hummus - fresh grocery product,4.2,https://via.placeholder.com/300x300?text=No+Image
1951,La Cubana Meal,Quality la cubana meal - fresh grocery product,8.68,https://via.placeholder.com/300x300?text=No+Image
2045,Multigrain Sandwich,Pain de mie multicéréales - 56% de céréales - 14 tranches,8.38,https://images.openfoodfacts.org/images/products/322/247/202/7195/front_fr.39.400.jpg
2076,Honey Smoked Sliced Turkey Breast,Premium Thin Sliced Honey Smoked Turkey Breast & White Turkey,3.98,https://via.placeholder.com/300x300?text=No+Image
2079,Hommus Garlic Lovers,Garlic Lovers Hommus,4.88,https://images.openfoodfacts.org/images/products/071/246/200/1173/front_en.3.400.jpg
2128,Authentic Recipe Guacamole,"Guacamole Authentic Recipe, Mild",4.88,https://images.openfoodfacts.org/images/products/076/711/951/1697/front_en.7.400.jpg
2234,Lunchables Ham & Cheddar with Cracker Stackers,Ham & Cheddar Cracker Stackers with Vanilla Crème Cookies,11.15,https://images.openfoodfacts.org/images/products/004/470/036/0002/front_en.29.400.jpg
2244,Seasonal Flavor Rotation Hummus,Quality seasonal flavor rotation hummus - fresh grocery product,6.72,https://via.placeholder.com/300x300?text=No+Image
2286,Cream Cheese With Jalapeño,El Tequito Cream Cheese Jalapeños with Chili Dip,3.75,https://images.openfoodfacts.org/images/products/000/002/083/1271/front_en.16.400.jpg
2310,Perfecto,Ricotta Light,7.15,https://images.openfoodfacts.org/images/products/931/005/310/2738/front_fr.10.400.jpg
2344,Organic SprouTofu Savory Baked Tofu,Quality organic sproutofu savory baked tofu - fresh grocery product,4.68,https://via.placeholder.com/300x300?text=No+Image
2360,Lorraine Quiche,Quiche Lorraine pur beurre,3.8,https://images.openfoodfacts.org/images/products/324/883/000/0587/front_fr.25.400.jpg
2426,Roasted Green Chile & Jack Cheese Tamales,Quality roasted green chile & jack cheese tamales - fresh grocery product,10.77,https://via.placeholder.com/300x300?text=No+Image
2428,Half Time Turkey Breast & American Cheese,Quality half time turkey breast & american cheese - fresh grocery product,12.07,https://via.placeholder.com/300x300?text=No+Image
2488,Spicy Guacamole,Guacamole spicy,11.46,https://images.openfoodfacts.org/images/products/506/050/431/0017/front_en.18.400.jpg
2539,Original Potato Salad,Potatissallad Original,11.5,https://images.openfoodfacts.org/images/products/731/316/141/9271/front_sv.6.400.jpg
2565,Guacamole Spicy,Guacamole spicy,10.02,https://images.openfoodfacts.org/images/products/506/050/431/0017/front_en.18.400.jpg
2583,Artichoke & Jalapeno Dip,Artichoke jalapeño and Parmesan,8.98,https://images.openfoodfacts.org/images/products/007/111/761/6859/front_en.3.400.jpg
2601,Lean Boiled Ham,Lean Boiled Ham,12.45,https://images.openfoodfacts.org/images/products/004/410/007/9054/front_en.7.400.jpg
2758,Black Forest Ham Vacuum Pack,Quality black forest ham vacuum pack - fresh grocery product,3.21,https://via.placeholder.com/300x300?text=No+Image
2791,Organic SprouTofu Hickory BBQ Smoked Tofu,Quality organic sproutofu hickory bbq smoked tofu - fresh grocery product,8.68,https://via.placeholder.com/300x300?text=No+Image
2807,Honey Garlic Marinated Grilled Flank Steak,Quality honey garlic marinated grilled flank steak - fresh grocery product,13.3,https://via.placeholder.com/300x300?text=No+Image
2825,Organic Original Hommus,Original Hommus Organic,7.69,https://images.openfoodfacts.org/images/products/004/411/540/3011/front_en.10.400.jpg
2839,Original Slices Pepperoni,"Original pepperoni slices, original",6.55,https://via.placeholder.com/300x300?text=No+Image
2924,Kalamata Olive Tapenade with Sundried Tomato,Quality kalamata olive tapenade with sundried tomato - fresh grocery product,6.76,https://via.placeholder.com/300x300?text=No+Image
2928,Bean and Cheese Gorditas,Quality bean and cheese gorditas - fresh grocery product,8.62,https://via.placeholder.com/300x300?text=No+Image
2941,Broccoli Salad,sweet potato and tenderstem broccoli,4.74,https://images.openfoodfacts.org/images/products/000/002/932/0547/front_en.17.400.jpg
2955,Hummus Easy Southwest Black Beans,Southwest Black Bean Hummus Made Easy,14.98,https://via.placeholder.com/300x300?text=No+Image
3057,Fresh Mild Salsa,Restaurant style mild salsa,1.33,https://images.openfoodfacts.org/images/products/085/114/600/2621/front_en.5.400.jpg
3072,Medium Green Salsa,Sauce épicée à base de tomates et morceaux de poivrons,11.27,https://images.openfoodfacts.org/images/products/356/470/029/9067/front_fr.47.400.jpg
3174,Sprouted Tofu Plus Organic Super Firm,Quality sprouted tofu plus organic super firm - fresh grocery product,8.34,https://via.placeholder.com/300x300?text=No+Image
3184,Deli Fresh Smoked Ham,Deli fresh smoked ham,6.38,https://images.openfoodfacts.org/images/products/004/470/003/1292/front_en.18.400.jpg
3248,Breakfast Burrito With Potatoes Jack & Cheddar Cheese & Meatless Chorizo,Quality breakfast burrito with potatoes jack & cheddar cheese & meatless chorizo - fresh grocery product,3.44,https://via.placeholder.com/300x300?text=No+Image
3280,Extra Firm Silken Tofu,Silken Tofu Extra Firm,5.48,https://images.openfoodfacts.org/images/products/008/569/660/8051/front_en.26.400.jpg
3302,Glazed Ham,Honey Glazed Ham Pringles,8.56,https://images.openfoodfacts.org/images/products/505/399/015/3862/front_en.17.400.jpg
3385,Super Firm Tofu,Organic Super Firm Tofu,10.34,https://images.openfoodfacts.org/images/products/406/146/357/8013/front_en.38.400.jpg
3405,Mushroom Spinach & Salsa Tamales With 2 Cheeses,Quality mushroom spinach & salsa tamales with 2 cheeses - fresh grocery product,10.77,https://via.placeholder.com/300x300?text=No+Image
3459,Guacamole Dips,Sauce apéritif Guacamole,3.45,https://images.openfoodfacts.org/images/products/841/007/642/1449/front_en.73.400.jpg
3516,Sushi Spicy Tuna Roll Ready To Eat,Quality sushi spicy tuna roll ready to eat - fresh grocery product,8.26,https://via.placeholder.com/300x300?text=No+Image
3552,"Bologna, German Brand","Wunderbar, german brand, bologna, made with pork, chicken, beef",9.3,https://via.placeholder.com/300x300?text=No+Image
3574,TofuPlus Organic Extra Firm Tofu,Quality tofuplus organic extra firm tofu - fresh grocery product,10.28,https://via.placeholder.com/300x300?text=No+Image
3649,Roasted Red Pepper Hummus with Pretzels,Roasted Red Pepper Hummus With Pretzels,5.56,https://images.openfoodfacts.org/images/products/003/003/495/7445/front_en.3.400.jpg
3650,Calabrese Spicy Salami,Pizzeria Stromboli Spicy Salami Calabrese & Ventricina,12.07,https://images.openfoodfacts.org/images/products/506/019/864/3866/front_en.23.400.jpg
3662,Smoked Shaved White Turkey,Premium shaved smoked turkey breast & white turkey,7.2,https://via.placeholder.com/300x300?text=No+Image
3697,Spinach Hummus,Artichoke Spinach Hummus,5.69,https://images.openfoodfacts.org/images/products/004/411/500/8285/front_en.7.400.jpg
3704,Organic Bunny Butter Parmesan Pasta,Quality organic bunny butter parmesan pasta - fresh grocery product,7.6,https://via.placeholder.com/300x300?text=No+Image
3734,Organic Veggie Carnitas,Organic Veggie Carnitas,6.71,https://via.placeholder.com/300x300?text=No+Image
3795,Oven Roasted Chicken,"Grilled & Ready, Oven Roasted Diced Chicken Breast",10.1,https://images.openfoodfacts.org/images/products/002/370/001/6270/front_en.15.400.jpg
3836,Spinach And Artichoke Hummus,Artichoke Spinach Hummus,9.71,https://images.openfoodfacts.org/images/products/004/411/500/8285/front_en.7.400.jpg
3856,Deli Fresh Smoked Turkey Breast,Oscar Mayer Deli Fresh Smoked Turkey Breast,2.01,https://images.openfoodfacts.org/images/products/004/470/003/1063/front_en.3.400.jpg
3902,Classic Green Chickpea Natural Hummus,Quality classic green chickpea natural hummus - fresh grocery product,11.18,https://via.placeholder.com/300x300?text=No+Image
3991,Moms Macaroni Salad,Just Like Mom's Elbow Macaroni Salad,12.69,https://via.placeholder.com/300x300?text=No+Image
4045,Medium Combo Ranchero Salsa,Quality medium combo ranchero salsa - fresh grocery product,4.83,https://via.placeholder.com/300x300?text=No+Image
4112,Chopped Salad Bowl Italian Salad with Salami & Turkey,Quality chopped salad bowl italian salad with salami & turkey - fresh grocery product,6.8,https://via.placeholder.com/300x300?text=No+Image
4150,Premium Genoa,"Columbus, premium genoa",10.45,https://via.placeholder.com/300x300?text=No+Image
4162,Organic Thai Coconut Curry Hummus,Organic Thai Coconut Curry Hummus,7.23,https://images.openfoodfacts.org/images/products/085/650/000/4037/front_en.5.400.jpg
4226,Black Pepper Turkey Breast,Oakham™ Turkey Breast with Butter & Black Pepper,5.01,https://images.openfoodfacts.org/images/products/000/000/031/9249/front_en.3.400.jpg
4251,Beef Lasagna Family Size,Quality beef lasagna family size - fresh grocery product,5.1,https://via.placeholder.com/300x300?text=No+Image
4294,Spicy Salmon Avocado Roll,Spicy salmon Avocado rolls,4.55,https://via.placeholder.com/300x300?text=No+Image
4320,Bento Box,Bento Box - Sushi,9.49,https://images.openfoodfacts.org/images/products/843/659/438/0099/front_es.13.400.jpg
4331,Premium Deli Smoked Ham,Smoked Premium Deli Ham,4.7,https://via.placeholder.com/300x300?text=No+Image
4365,Hummus With Roasted Garlic,"Chickpeas and sesame tahini blended with roasted red pepper and a hint of garlic & basil hummus, red pepper hummus",5.02,https://via.placeholder.com/300x300?text=No+Image
4369,American Potato Salad,American potato salad,5.59,https://via.placeholder.com/300x300?text=No+Image
4372,Hot Guacamole,"Medium / hot traditional guacamole, medium / hot",12.26,https://via.placeholder.com/300x300?text=No+Image
4404,"Le Bon Basil, Zucchini & Parmesan Dip","Quality le bon basil, zucchini & parmesan dip - fresh grocery product",3.27,https://via.placeholder.com/300x300?text=No+Image
4417,Organic Veggie Ground,Veggie Hack,5.36,https://images.openfoodfacts.org/images/products/430/561/578/3208/front_de.21.400.jpg
4419,Mini Duck Rillette,Quality mini duck rillette - fresh grocery product,13.88,https://via.placeholder.com/300x300?text=No+Image
4522,Dill Veggie Dip,Dill! veggie dip,2.75,https://images.openfoodfacts.org/images/products/007/020/052/2022/front_en.4.400.jpg
4523,Calamari Tubes & Tentacles,Rhode Island Calamari Tubes And Tentacles,6.51,https://via.placeholder.com/300x300?text=No+Image
4527,Chicken Quesadillas,Southwest chicken quesadillas with seasoned vegetables,7.11,https://images.openfoodfacts.org/images/products/000/000/087/0023/front_en.4.400.jpg
4557,Mango Peach Salsa,Mango With Peach Salsa,8.72,https://via.placeholder.com/300x300?text=No+Image
4595,Italian Dry Salame,Reduced sodium italian dry salame,6.49,https://images.openfoodfacts.org/images/products/007/300/710/1957/front_en.3.400.jpg
4597,"Organic Tempeh, Garden Veggie",Organic Garden Veggie Tempeh,4.61,https://via.placeholder.com/300x300?text=No+Image
4604,Cannoli,Mini Cannoli,1.8,https://images.openfoodfacts.org/images/products/000/002/004/8280/front_nl.30.400.jpg
4638,Lunchables Uploaded 6-inch Turkey & Cheddar Sub Sandwich,Quality lunchables uploaded 6-inch turkey & cheddar sub sandwich - fresh grocery product,3.15,https://via.placeholder.com/300x300?text=No+Image
4689,Mini Vegan Terrine,Quality mini vegan terrine - fresh grocery product,14.42,https://via.placeholder.com/300x300?text=No+Image
4763,Pork Potstickers,Pork Potstickers,14.56,https://images.openfoodfacts.org/images/products/007/007/783/0206/front_en.7.400.jpg
4765,"Salami, Italian Dry",Columbus italian dry salami reduced sodium sliced,5.36,https://images.openfoodfacts.org/images/products/007/300/710/1162/front_en.13.400.jpg
4977,Mushroom Barley Soup,Mushroom Barley Soup Mix,12.56,https://via.placeholder.com/300x300?text=No+Image
5009,Yuba Tofu Skin,Dried Bean Curd Stick,3.25,https://via.placeholder.com/300x300?text=No+Image
5031,Medium Salsa Roja,"Medium roasted salsa roja, medium",8.0,https://images.openfoodfacts.org/images/products/007/287/878/5303/front_en.6.400.jpg
5034,"P3 Smoked Ham, Cheese & Cashews Portable Protein Packs","Quality p3 smoked ham, cheese & cashews portable protein packs - fresh grocery product",8.23,https://via.placeholder.com/300x300?text=No+Image
5040,"All-Purpose Sauce, Kale Tahini",Kale Tahini All-Purpose Sauce,5.2,https://images.openfoodfacts.org/images/products/064/139/423/1030/front_en.3.400.jpg
5083,98% Fat Free Premium Ham With Natural Juices,Quality 98% fat free premium ham with natural juices - fresh grocery product,5.08,https://via.placeholder.com/300x300?text=No+Image
5189,Jack's Special Mild Salsa,"Garden fresh gourmet, jack's special salsa, mild, mild",14.53,https://via.placeholder.com/300x300?text=No+Image
5246,Mango Jalapeno Quinoa Meal,"Mango & jalapeno quinoa meal, mango & jalapeno",5.16,https://via.placeholder.com/300x300?text=No+Image
5293,Eduardo's Orzo Melon Seeds Enriched Egg Pasta,Quality eduardo's orzo melon seeds enriched egg pasta - fresh grocery product,9.53,https://via.placeholder.com/300x300?text=No+Image
5314,"Supremely Spicy Hummus, Family Size","Quality supremely spicy hummus, family size - fresh grocery product",8.32,https://via.placeholder.com/300x300?text=No+Image
5351,Smoked Whitefish Salad,Smoked Whitefish Salad,14.35,https://images.openfoodfacts.org/images/products/002/338/427/0272/front_en.8.400.jpg
5353,Two Organic Cornmeal Pizza Crusts,Quality two organic cornmeal pizza crusts - fresh grocery product,2.62,https://via.placeholder.com/300x300?text=No+Image
5370,Slow Roasted Thai Basil Chick'n,Slow Roasted Chick'N Thai Basil,6.44,https://images.openfoodfacts.org/images/products/002/558/300/5259/front_en.6.400.jpg
5371,All Natural Thai Dumplings,Quality all natural thai dumplings - fresh grocery product,9.76,https://via.placeholder.com/300x300?text=No+Image
5438,Prosciutto,recategorisation du product_id 635267 | excatego:251 | exns:B/1,8.66,https://images.openfoodfacts.org/images/products/324/227/234/6050/front_en.162.400.jpg
5456,Green Tea With Ginseng and Honey,Green Tea with Ginseng and Honey,10.59,https://images.openfoodfacts.org/images/products/061/300/871/5267/front_en.48.400.jpg
5477,Roasted Pine Nut Hommus,Roasted Pine Nut Hommus,3.74,https://via.placeholder.com/300x300?text=No+Image
5528,HUMMUS 10OZ  WHITE BEAN EAT WELL,Quality hummus 10oz  white bean eat well - fresh grocery product,8.35,https://via.placeholder.com/300x300?text=No+Image
5539,Organic SprouTofu Silken Tofu,Quality organic sproutofu silken tofu - fresh grocery product,9.37,https://via.placeholder.com/300x300?text=No+Image
5568,Lunchmeat,Ultra thin sliced lunchmeat lower sodium honey ham,13.11,https://images.openfoodfacts.org/images/products/004/450/097/6458/front_en.4.400.jpg
5576,"Deli Fresh Maple Honey Ham, Bold, 97% Fat Free, Gluten Free","Quality deli fresh maple honey ham, bold, 97% fat free, gluten free - fresh grocery product",1.99,https://via.placeholder.com/300x300?text=No+Image
5653,Chicken Curry Salad,Poke bol Fettucine poulet mangue sauce curry,8.25,https://images.openfoodfacts.org/images/products/370/000/927/5696/front_fr.3.400.jpg
5686,Organic Vegi-D Zing Salad Salt Free,Quality organic vegi-d zing salad salt free - fresh grocery product,9.97,https://via.placeholder.com/300x300?text=No+Image
5688,Organic Tofu Veggie Burger,Burger tofu y espinacas veggie,7.35,https://images.openfoodfacts.org/images/products/848/001/035/1538/front_es.3.400.jpg
5728,Traditional Kettle Style Tofu,Quality traditional kettle style tofu - fresh grocery product,6.43,https://via.placeholder.com/300x300?text=No+Image
5764,Organic SprouTofu Teriyaki Tofu Cutlets,Quality organic sproutofu teriyaki tofu cutlets - fresh grocery product,11.62,https://via.placeholder.com/300x300?text=No+Image
5791,"Cabbage, Napa, Table Cut",Kimchi Vegan Napa Cabbage Table Cut,11.86,https://images.openfoodfacts.org/images/products/085/523/000/2047/front_en.3.400.jpg
5808,Turkey Pastrami,"Viande de cuisse de dinde, préparée en salaison et fumée",6.23,https://images.openfoodfacts.org/images/products/729/001/474/6350/front_fr.15.400.jpg
5858,Three Sisters Chili,"Better bean, three sisters chili, beans, corn, squash & ancho pepper",11.13,https://via.placeholder.com/300x300?text=No+Image
5957,Naturals Roast Beef,"Niman ranch, roast sliced beef rubeed with natural seasonings",14.29,https://via.placeholder.com/300x300?text=No+Image
5973,Spicy Avocado Hummus,Organic Hummus Spicy Avocado,7.11,https://images.openfoodfacts.org/images/products/085/650/000/4013/front_en.5.400.jpg
6060,Turkey Salami Slices,Quality turkey salami slices - fresh grocery product,1.01,https://via.placeholder.com/300x300?text=No+Image
6142,Roasted Garlic Family Size Hummus,Quality roasted garlic family size hummus - fresh grocery product,9.37,https://via.placeholder.com/300x300?text=No+Image
6220,Organic Harvest Vegetable Hummus,Harvest vegetable hummus,5.77,https://images.openfoodfacts.org/images/products/004/411/544/8173/front_en.3.400.jpg
6311,PS Genoa Salami,Quality ps genoa salami - fresh grocery product,6.35,https://via.placeholder.com/300x300?text=No+Image
6355,Whole Wheat Pizza Dough,"Chompie's bakery, new york style pizza crust, whole wheat",3.99,https://via.placeholder.com/300x300?text=No+Image
