product_id,product_name,description,price,image_url
25595,Chilled Gazpacho De Sol Vegetable Soup,Quality chilled gazpacho de sol vegetable soup - fresh grocery product,4.1,https://via.placeholder.com/300x300?text=No+Image
25599,Lunchables Turkey & Cheddar Sub Sandwich With Smoothie Lunch Combinations,Quality lunchables turkey & cheddar sub sandwich with smoothie lunch combinations - fresh grocery product,10.06,https://via.placeholder.com/300x300?text=No+Image
25623,Real Guacamole,Real Guacamole,14.47,https://via.placeholder.com/300x300?text=No+Image
25695,Extra Firm Sprouted Soybean Tofu,Quality extra firm sprouted soybean tofu - fresh grocery product,1.67,https://via.placeholder.com/300x300?text=No+Image
25698,Egg Salad Sandwich,Simply Egg Salad Sandwich,3.39,https://images.openfoodfacts.org/images/products/005/254/867/8364/front_en.8.400.jpg
25727,Delifresh Combos The Honey Smoked Turkey Breast Honey Ham,Quality delifresh combos the honey smoked turkey breast honey ham - fresh grocery product,8.58,https://via.placeholder.com/300x300?text=No+Image
25757,Spinach Artichoke Noodles,Quality spinach artichoke noodles - fresh grocery product,13.25,https://via.placeholder.com/300x300?text=No+Image
25787,Chicken Seitan,Seitan Plant chunks chicken style,12.14,https://images.openfoodfacts.org/images/products/403/227/701/1270/front_fr.3.400.jpg
25852,Edamame,"Mélange de légumes, céréales et quinoa cuisiné surgelé",9.3,https://images.openfoodfacts.org/images/products/308/368/110/5247/front_fr.43.400.jpg
25862,Calabrese Bite Size Spicy Salamini,Quality calabrese bite size spicy salamini - fresh grocery product,12.39,https://via.placeholder.com/300x300?text=No+Image
25960,Corn Souffle,Maïs soufflé avec enrobage caramel.,8.17,https://images.openfoodfacts.org/images/products/401/710/076/4004/front_fr.64.400.jpg
25965,Santa Fe Fiesta Salad,Quality santa fe fiesta salad - fresh grocery product,8.33,https://via.placeholder.com/300x300?text=No+Image
26006,Deli Select Ultra Thin Smoked Ham Lunch Meat,Quality deli select ultra thin smoked ham lunch meat - fresh grocery product,11.41,https://via.placeholder.com/300x300?text=No+Image
26040,"Deli Fresh Honey Ham, 97% Fat Free, Gluten Free","Quality deli fresh honey ham, 97% fat free, gluten free - fresh grocery product",7.93,https://via.placeholder.com/300x300?text=No+Image
26041,Pub Burger,Pub Style Chicken Burgers,14.67,https://images.openfoodfacts.org/images/products/006/929/912/6914/front_en.24.400.jpg
26047,Tuna Salad,Salade mexicaine au thon,8.5,https://images.openfoodfacts.org/images/products/800/403/002/6018/front_en.101.400.jpg
26147,Organic Seitan,Seitan veggie,6.21,https://images.openfoodfacts.org/images/products/322/982/079/6642/front_fr.86.400.jpg
26162,Pepperoni And Cheese Snack Tray,"Italian Style Pinwheel Snack Tray With Provolone Cheese, Pepperoni, Honey Ham, And Genoa Salami, Italian Style",11.84,https://via.placeholder.com/300x300?text=No+Image
26189,Southwest Veggie Burger,Organic Southwest Adzuki Bean Veggie Burger,12.1,https://via.placeholder.com/300x300?text=No+Image
26352,Chicken Caesar Salad,"Salade composée de salade verte, de crudités et de poulet rôti traitée en salaison accomapgnée d'une sauce caesar",12.75,https://images.openfoodfacts.org/images/products/336/765/100/4878/front_fr.123.400.jpg
26376,Shrimp Spring Roll,Asia-Snacks + Chili-sauce,11.11,https://images.openfoodfacts.org/images/products/764/107/900/5676/front_fr.48.400.jpg
26383,Beef Cotto Salami,Beef Cotto Salami,10.57,https://images.openfoodfacts.org/images/products/004/470/001/1201/front_en.3.400.jpg
26453,Organic SprouTofu Royal Thai Baked Tofu,Quality organic sproutofu royal thai baked tofu - fresh grocery product,8.67,https://via.placeholder.com/300x300?text=No+Image
26490,Bistro Favorites Black Forest Ham,Land o'frost bistro favorites black forest uncured ham,1.98,https://images.openfoodfacts.org/images/products/005/190/080/7459/front_en.4.400.jpg
26506,Zesty Sriracha Carrot Hummus,Carrot hummus,12.38,https://via.placeholder.com/300x300?text=No+Image
26533,Smoked Norwegian Salmon,Saumon fumé,9.62,https://images.openfoodfacts.org/images/products/000/002/038/8508/front_fr.60.400.jpg
26615,Rev #2 Ham & Cheese,"Hormel, rev, a.m. soft white wrap, ham, egg & cheese",7.22,https://via.placeholder.com/300x300?text=No+Image
26635,Medium Tomatillo Salsa,"Tomatillo Salsa With Roasted Serrano & Cilantro, Medium",7.14,https://via.placeholder.com/300x300?text=No+Image
26655,Natural Roast Beef,"Niman ranch, roast sliced beef rubeed with natural seasonings",12.09,https://via.placeholder.com/300x300?text=No+Image
26687,Beef Pastrami,Plant-based beef style slices made from wheat gluten with herbs,11.72,https://images.openfoodfacts.org/images/products/501/029/296/3094/front_en.26.400.jpg
26714,Chicken Salad,Salade & Compagnie Manhattan Poulet Roti,9.23,https://images.openfoodfacts.org/images/products/324/227/403/0056/front_fr.69.400.jpg
26830,Hummus Spicy Three Pepper,Spicy three pepper topped hummus,2.94,https://images.openfoodfacts.org/images/products/002/113/012/7627/front_en.4.400.jpg
26870,New England Clam Chowder,Chunky New England Clam Chowder,9.79,https://images.openfoodfacts.org/images/products/005/100/000/5243/front_en.18.400.jpg
26892,Everything Hummus,Everything bagel hummus,7.76,https://via.placeholder.com/300x300?text=No+Image
27085,Mango Pineapple Salsa,"Hatch valley medium pineapple mango jalapeno salsa, pineapple mango",11.84,https://via.placeholder.com/300x300?text=No+Image
27143,Spicy Three Pepper Hummus,Spicy three pepper topped hummus,5.37,https://images.openfoodfacts.org/images/products/002/113/012/7627/front_en.4.400.jpg
27216,Macaroni Salad,Macaroni Salad,7.85,https://images.openfoodfacts.org/images/products/007/874/212/6531/front_en.8.400.jpg
27289,Elbow Macaroni & Cheese Side Dished,Quality elbow macaroni & cheese side dished - fresh grocery product,12.35,https://via.placeholder.com/300x300?text=No+Image
27299,Organic SprouTofu Firm Water Packed Tofu,Quality organic sproutofu firm water packed tofu - fresh grocery product,4.73,https://via.placeholder.com/300x300?text=No+Image
27344,Uncured Genoa Salami,Uncured genoa salami,7.77,https://images.openfoodfacts.org/images/products/002/531/765/6009/front_en.7.400.jpg
27356,French Onion Dip,sour cream based sauce.,6.75,https://images.openfoodfacts.org/images/products/002/840/007/0942/front_en.33.400.jpg
27380,Shiitake Mushroom Rice Scooter,Quality shiitake mushroom rice scooter - fresh grocery product,9.31,https://via.placeholder.com/300x300?text=No+Image
27388,Lunchable Extra Cheesy Pizza,Extra Cheesy Pizza,13.92,https://images.openfoodfacts.org/images/products/004/470/002/4119/front_en.13.400.jpg
27514,Maple Glazed Honey Ham,"Honey roasted peanuts, sunflower kernels, maple glazed ham jerky portable protein pack, honey roasted, maple glazed",12.54,https://via.placeholder.com/300x300?text=No+Image
27519,Bresaola,Affettato vegetale gusto bresaola,12.0,https://images.openfoodfacts.org/images/products/405/648/972/2687/front_en.3.400.jpg
27559,Lentil Crackers And Humus Classic,Quality lentil crackers and humus classic - fresh grocery product,5.78,https://via.placeholder.com/300x300?text=No+Image
27572,Natural Casing Polska Kielbasa,Quality natural casing polska kielbasa - fresh grocery product,13.2,https://via.placeholder.com/300x300?text=No+Image
27593,Le Petite Fromage Garden Salsa Spreadable Cheese,Quality le petite fromage garden salsa spreadable cheese - fresh grocery product,11.91,https://via.placeholder.com/300x300?text=No+Image
27596,Classic Original Hommus,Original Hommus,13.99,https://images.openfoodfacts.org/images/products/004/411/520/1013/front_en.3.400.jpg
27643,Veggie Burgers,"Préparation précuite composée de protéines de blé, protéines de soja et protéines de pois - Convient à un régime végétarien.",10.9,https://images.openfoodfacts.org/images/products/356/007/123/4140/front_fr.55.400.jpg
27649,Pre-Sliced Black Forest Ham,Pre-sliced Black Forest ham,14.94,https://via.placeholder.com/300x300?text=No+Image
27658,Farms Thin Sliced Smoked Ham,Quality farms thin sliced smoked ham - fresh grocery product,14.85,https://via.placeholder.com/300x300?text=No+Image
27741,Organic Extra Firm Cubed Tofu,"O organics, organic extra firm cubed tofu",10.37,https://via.placeholder.com/300x300?text=No+Image
27742,Premium Deli Honey Ham,"Premium deli ham, honey",10.23,https://via.placeholder.com/300x300?text=No+Image
27757,Beef Salami,Salami Pfeffer,11.76,https://images.openfoodfacts.org/images/products/000/002/003/6379/front_de.44.400.jpg
27764,Chopped Chicken Livers,Cindi's chopped chicken liver,9.61,https://via.placeholder.com/300x300?text=No+Image
27817,Fresh Medium Salsa,Restaurant style medium salsa,6.01,https://images.openfoodfacts.org/images/products/085/114/600/2638/front_en.5.400.jpg
27900,Vegan Apple Maple Breakfast Sausage,Apple & Maple Plant-Based Breakfast Sausages,4.61,https://images.openfoodfacts.org/images/products/063/803/161/1805/front_en.19.400.jpg
27910,Chicken Burrito Bowl,Chicken burrito bowl,5.16,https://images.openfoodfacts.org/images/products/000/000/057/7502/front_en.29.400.jpg
27922,Sun-Dried Tomato Spread,"Everything Spread, Sun-Dried Tomato & Basil, Mild",4.49,https://via.placeholder.com/300x300?text=No+Image
27944,Organic Garlic Lovers Hummus,Organic Hommus Garlic Lovers,13.21,https://images.openfoodfacts.org/images/products/004/411/544/8210/front_en.3.400.jpg
27956,Deli Snackers Turkey Breast/Ham/Mild Cheddar Cheese Portable Protein Pack,Quality deli snackers turkey breast/ham/mild cheddar cheese portable protein pack - fresh grocery product,12.65,https://via.placeholder.com/300x300?text=No+Image
27990,Chicken Burrito,Big Burrito - Chicken Curry,1.93,https://images.openfoodfacts.org/images/products/406/146/167/0580/front_de.9.400.jpg
28008,Greek Salad,Greek style salad cheese,11.12,https://images.openfoodfacts.org/images/products/000/002/089/8717/front_en.3.400.jpg
28054,Roasted Red Pepper Hummus With Chips,Roasted Red Pepper Hummus With Hummus Chips,7.8,https://images.openfoodfacts.org/images/products/072/543/998/0920/front_en.9.400.jpg
28071,Olive Hummus,Organic Houmous ~ With added extra virgin olive oil,10.37,https://images.openfoodfacts.org/images/products/000/000/030/2661/front_en.21.400.jpg
28144,Tabouli,Premium tabouli - high quality grocery product,1.71,https://via.placeholder.com/300x300?text=No+Image
28228,Mesquite Smoked Turkey Breast,"Turkey Breast, Mesquite Smoked",7.03,https://images.openfoodfacts.org/images/products/004/470/005/8626/front_en.4.400.jpg
28308,Loaded Cheddar Potato Bake Cups,"Stouffer's, loaded cheddar potato bake cups",11.56,https://via.placeholder.com/300x300?text=No+Image
28357,Edamame Hummus,CREMA DE GARBANZO CON TAHINA 100%NATURAL,12.75,https://images.openfoodfacts.org/images/products/843/655/787/0605/front_es.6.400.jpg
28369,Lite Italian Dry Salame,"Columbus, lite italian dry salame",1.37,https://via.placeholder.com/300x300?text=No+Image
28373,Original Rotisserie Chicken,"Rotisserie chicken, original",10.73,https://via.placeholder.com/300x300?text=No+Image
28389,Butternut Squash Lasagna,Butternut Squash Lasagna with Chicken,1.72,https://via.placeholder.com/300x300?text=No+Image
28436,Deviled Egg Tray,Quality deviled egg tray - fresh grocery product,14.53,https://via.placeholder.com/300x300?text=No+Image
28453,Premium Old World Style Black Forest Ham,Quality premium old world style black forest ham - fresh grocery product,8.37,https://via.placeholder.com/300x300?text=No+Image
28457,Lentil Curry,Thai Curry Lentil And Peas Veggie Cakes,7.04,https://images.openfoodfacts.org/images/products/501/366/511/7193/front_en.28.400.jpg
28468,Veggie Canadian Bacon,Quality veggie canadian bacon - fresh grocery product,5.18,https://via.placeholder.com/300x300?text=No+Image
28537,Hand-Formed Vegan Burger Patties,Quality hand-formed vegan burger patties - fresh grocery product,9.18,https://via.placeholder.com/300x300?text=No+Image
28560,Natural Choice Smoked Deli Ham,Quality natural choice smoked deli ham - fresh grocery product,8.97,https://via.placeholder.com/300x300?text=No+Image
28615,Baba Ghanouj,Baba ghanouj roasted eggplant dip & spread,12.32,https://images.openfoodfacts.org/images/products/006/038/303/5921/front_fr.11.400.jpg
28634,Hard Salami,Hard Salami,7.72,https://images.openfoodfacts.org/images/products/004/450/020/1703/front_en.13.400.jpg
28678,Salmon Burgers,Alaska salmon burgers,11.98,https://images.openfoodfacts.org/images/products/002/802/908/8816/front_en.29.400.jpg
28685,"Ready Snax Fruit, Cheese & Flatbread Snack Pack","Quality ready snax fruit, cheese & flatbread snack pack - fresh grocery product",12.43,https://via.placeholder.com/300x300?text=No+Image
28698,Asian Noodle Salad,Asian Noodle Salad,4.01,https://images.openfoodfacts.org/images/products/077/320/071/8043/front_en.16.400.jpg
28711,Tamale Pepper Cheese 3 Pk,Quality tamale pepper cheese 3 pk - fresh grocery product,8.88,https://via.placeholder.com/300x300?text=No+Image
28745,Oven Roasted Turkey,"Oven roasted turkey breast, oven roasted",12.67,https://images.openfoodfacts.org/images/products/002/531/758/6009/front_en.28.400.jpg
28756,Deviled Eggs,"Deviled egg potato salad, deviled egg",1.46,https://images.openfoodfacts.org/images/products/007/111/700/4809/front_en.5.400.jpg
28768,Cracker Crunchers Chicken with Nestle Crunch Bar LunchMakers,Quality cracker crunchers chicken with nestle crunch bar lunchmakers - fresh grocery product,7.66,https://via.placeholder.com/300x300?text=No+Image
28782,Zesty Lemon Hommus,Zesty Lemon Hommus,9.21,https://images.openfoodfacts.org/images/products/004/411/500/8186/front_en.22.400.jpg
28799,Shredded Chicken,Battered Shredded Chicken,12.4,https://images.openfoodfacts.org/images/products/405/648/925/2399/front_en.3.400.jpg
28874,Carrot Ginger Soup,Roasted carrot ginger soup,11.56,https://images.openfoodfacts.org/images/products/506/066/091/0038/front_en.14.400.jpg
28888,"Turkey Breast, Honey Roasted, Lower Sodium","Quality turkey breast, honey roasted, lower sodium - fresh grocery product",14.5,https://via.placeholder.com/300x300?text=No+Image
28914,Carmelized Onion Hummus,Carmelized onion hummus,1.21,https://images.openfoodfacts.org/images/products/007/789/048/2179/front_en.3.400.jpg
28928,Uncured Black Forest Ham,Uncured Black Forest Ham,1.59,https://images.openfoodfacts.org/images/products/002/531/700/5906/front_en.5.400.jpg
28953,Smoked Turkey,Turkey Breast - Smoked,14.26,https://images.openfoodfacts.org/images/products/309/575/631/2016/front_en.322.400.jpg
28954,Classic Rotisserie Chicken,Quality classic rotisserie chicken - fresh grocery product,1.03,https://via.placeholder.com/300x300?text=No+Image
29022,Oven Roasted Turkey Breast Slices,Oven Roasted Turkey Breast,9.35,https://images.openfoodfacts.org/images/products/006/310/010/8731/front_en.14.400.jpg
29024,Organic Baked Aloha Tofu,"Wildwood Organic, Sproutofu, Baked Tofu, Aloha",10.09,https://via.placeholder.com/300x300?text=No+Image
29066,Beyond Chicken Grilled Strips,Beyond grilled chicken strips,9.99,https://via.placeholder.com/300x300?text=No+Image
29154,Trading Company Pinto Bean Dip Medium Hot,Quality trading company pinto bean dip medium hot - fresh grocery product,8.58,https://via.placeholder.com/300x300?text=No+Image
29180,Tuscan Kale & Quinoa Salad,Quality tuscan kale & quinoa salad - fresh grocery product,2.75,https://via.placeholder.com/300x300?text=No+Image
29192,Lean Beef Salami,HEBREW NATIONAL Lean Beef Salami Roll,10.5,https://via.placeholder.com/300x300?text=No+Image
29221,Veggie Deli Ham,Quality veggie deli ham - fresh grocery product,9.38,https://via.placeholder.com/300x300?text=No+Image
29231,Spicy Veggie Wraps,Spicy veggie wrap,12.3,https://images.openfoodfacts.org/images/products/408/860/045/7994/front_en.8.400.jpg
29257,Gluten Free Hickory Smoked Tofu,Quality gluten free hickory smoked tofu - fresh grocery product,10.86,https://via.placeholder.com/300x300?text=No+Image
29294,Italian Style Wrap,Italian Style Wrap,6.63,https://images.openfoodfacts.org/images/products/000/000/094/0597/front_en.3.400.jpg
29379,Strawberry Cream Cheese Fruit Dip,Strawberry cream cheese fruit dip,8.7,https://images.openfoodfacts.org/images/products/007/020/053/0140/front_en.5.400.jpg
29433,Deli Shaved Oven Roasted Turkey,Deli Shaved Oven Roasted Turkey Breast,11.74,https://images.openfoodfacts.org/images/products/001/590/006/6247/front_en.3.400.jpg
29453,Salamini Napoli,Quality salamini napoli - fresh grocery product,6.55,https://via.placeholder.com/300x300?text=No+Image
29475,Salad Bar,Little Salad Bar,3.6,https://images.openfoodfacts.org/images/products/409/910/008/3453/front_en.19.400.jpg
29532,Cashew Sesame Pimento Spread,Quality cashew sesame pimento spread - fresh grocery product,1.5,https://via.placeholder.com/300x300?text=No+Image
29540,Chop Chipotle Chedder Kit,Quality chop chipotle chedder kit - fresh grocery product,4.06,https://via.placeholder.com/300x300?text=No+Image
29583,Gold Medal Pate,Mister Choc,1.05,https://images.openfoodfacts.org/images/products/000/002/000/3555/front_en.46.400.jpg
29593,Lite Firm Silken Tofu,Quality lite firm silken tofu - fresh grocery product,1.74,https://via.placeholder.com/300x300?text=No+Image
29600,Spinach Feta Cheese Pie,Filo spinach twist pie,4.1,https://images.openfoodfacts.org/images/products/520/123/110/1206/front_en.14.400.jpg
29724,Chorizo Hemp Soy-Free Tofu,Quality chorizo hemp soy-free tofu - fresh grocery product,2.52,https://via.placeholder.com/300x300?text=No+Image
29746,Red Skin Potato Salad,Red Skin Potato Salad,9.39,https://via.placeholder.com/300x300?text=No+Image
29758,Extra Cheesy Pizza Lunchables,Extra Cheesy Pizza,5.38,https://images.openfoodfacts.org/images/products/004/470/002/4119/front_en.13.400.jpg
29851,Tofu Soft,Silken Tofu Soft imp,7.23,https://images.openfoodfacts.org/images/products/008/569/660/8037/front_en.38.400.jpg
29871,Organic Roast Beef,Grass-fed Roast beef,1.95,https://images.openfoodfacts.org/images/products/002/531/715/6745/front_en.12.400.jpg
29904,Gatherings Honey Ham & Turkey Party Tray,Quality gatherings honey ham & turkey party tray - fresh grocery product,13.98,https://via.placeholder.com/300x300?text=No+Image
29977,Bacon Style Slices,Seasoned Meat-Free Smoked Streaky Bacon Style Slices made with Rehydrated Textured Soya and Wheat Protein,11.21,https://images.openfoodfacts.org/images/products/500/034/200/0428/front_en.16.400.jpg
30037,Thin Sliced Ham,Honey roast wafer thin british ham slices,12.14,https://images.openfoodfacts.org/images/products/000/000/183/4635/front_en.13.400.jpg
30142,Vegetable Dumpling,Vegetable fusion gyoza,14.31,https://images.openfoodfacts.org/images/products/506/026/248/9598/front_en.22.400.jpg
30213,Organic Cook Me Mixed Vegetables,Quality organic cook me mixed vegetables - fresh grocery product,1.93,https://via.placeholder.com/300x300?text=No+Image
30245,Black Bean Tamales,Tamale Verde Black Bean,9.22,https://images.openfoodfacts.org/images/products/004/227/200/2696/front_en.6.400.jpg
30260,Original Fresh Salsa,Original Salsa,11.82,https://via.placeholder.com/300x300?text=No+Image
30262,Seitan Chops,Quality seitan chops - fresh grocery product,4.64,https://via.placeholder.com/300x300?text=No+Image
30363,Avocado Hommus,Avocado Hommus,7.78,https://images.openfoodfacts.org/images/products/004/411/500/8308/front_en.3.400.jpg
30475,REV #13 Bacon Club,Quality rev #13 bacon club - fresh grocery product,11.6,https://via.placeholder.com/300x300?text=No+Image
30489,Original Hummus,Original Hummus,2.95,https://images.openfoodfacts.org/images/products/506/050/431/0918/front_en.3.400.jpg
30506,Hummus Roasted Pepper,Smoky Roasted Red Pepper Houmous,6.43,https://images.openfoodfacts.org/images/products/000/000/117/5424/front_en.19.400.jpg
30629,Southwest Couscous Salad,Southwest couscous salad,5.51,https://via.placeholder.com/300x300?text=No+Image
30647,Oven Roasted Shaved White Turkey,HEB Deli Shaved Oven Roasted Turkey Breast and White Turkey Meat,11.82,https://images.openfoodfacts.org/images/products/004/122/098/1007/front_en.3.400.jpg
30742,Veggie Pepperoni Pizza,Uncured turkey pepperoni & veggies pizza,13.9,https://via.placeholder.com/300x300?text=No+Image
30748,Cheese & Garlic Croutons,New york cheese and garlic texas toast croutons,13.79,https://via.placeholder.com/300x300?text=No+Image
30763,Garden Vegetable Soup,Vegetable soup,3.06,https://images.openfoodfacts.org/images/products/505/605/330/5802/front_en.3.400.jpg
30777,Organic Classic Hummus,Organic Houmous,12.16,https://images.openfoodfacts.org/images/products/000/001/006/6980/front_en.26.400.jpg
30795,Sesame Seaweed Salad,Sesame Seaweed Salad,9.85,https://via.placeholder.com/300x300?text=No+Image
30843,Detox Salad,Salade gourmande Détox,13.39,https://images.openfoodfacts.org/images/products/370/047/766/0680/front_fr.26.400.jpg
30938,Wholly Guacamole Mini 12 Oz,Quality wholly guacamole mini 12 oz - fresh grocery product,11.84,https://via.placeholder.com/300x300?text=No+Image
30977,Habanero Salsa,Ancho & Habanero Chilli Salsa Corn Masa Tortillas,6.15,https://images.openfoodfacts.org/images/products/506/333/400/0288/front_en.12.400.jpg
30982,All Natural Original Hummus,Quality all natural original hummus - fresh grocery product,10.78,https://via.placeholder.com/300x300?text=No+Image
31009,Greek Style Hummus,Greek Style Hummus,12.74,https://via.placeholder.com/300x300?text=No+Image
31093,Original Tofu Pups,Quality original tofu pups - fresh grocery product,6.59,https://via.placeholder.com/300x300?text=No+Image
31155,Tofu Ground Beef,Quality tofu ground beef - fresh grocery product,11.95,https://via.placeholder.com/300x300?text=No+Image
31181,Organic Garlic Hommus,Organic Garlic Hommus With Toppings,4.18,https://images.openfoodfacts.org/images/products/004/411/540/3035/front_en.5.400.jpg
31188,Italian Seitan,Italian seitan,10.27,https://images.openfoodfacts.org/images/products/068/907/676/2878/front_en.16.400.jpg
31242,Pico De Gallo Chunky Salsa,Hot Roasted Chunky Pico de Gallo,1.73,https://via.placeholder.com/300x300?text=No+Image
31293,Chicken With Rice Soup,Rice noodles with a chicken flavour and sesame miso based broth and dried vegetables,8.05,https://images.openfoodfacts.org/images/products/506/026/248/9741/front_en.26.400.jpg
31305,Light Italian Dry Salame,Italian dry salame light less fat deli thin sliced,5.21,https://images.openfoodfacts.org/images/products/004/450/000/3864/front_en.7.400.jpg
31306,Pancetta Italian Style Dry Cured Bacon,Quality pancetta italian style dry cured bacon - fresh grocery product,8.23,https://via.placeholder.com/300x300?text=No+Image
31315,Cobb Salad With Chicken & Bacon,Cobb Salad With Chicken And Bacon,9.15,https://via.placeholder.com/300x300?text=No+Image
31337,Organic Hummus Spicy Jalapeño Cilantro,Quality organic hummus spicy jalapeño cilantro - fresh grocery product,13.1,https://via.placeholder.com/300x300?text=No+Image
31342,Organic SprouTofu Extra Firm Tofu,Quality organic sproutofu extra firm tofu - fresh grocery product,11.93,https://via.placeholder.com/300x300?text=No+Image
31359,Braunschweiger Liverwurst,Liverwurst Braunschweiger,12.34,https://via.placeholder.com/300x300?text=No+Image
31440,Felino & Manchego Salami & Cheese,Felino uncured salami,4.35,https://images.openfoodfacts.org/images/products/085/073/200/6340/front_en.11.400.jpg
31451,Mac And Cheese,Macaroni & Cheese,6.47,https://images.openfoodfacts.org/images/products/002/100/065/8831/front_en.97.400.jpg
31522,Lemon Rice,Lemon & Herb Basmati Rice,5.85,https://images.openfoodfacts.org/images/products/501/115/788/8323/front_en.12.400.jpg
31600,Jamaican Jerk Hemp Seed Salad,Quality jamaican jerk hemp seed salad - fresh grocery product,6.7,https://via.placeholder.com/300x300?text=No+Image
31641,Mango Salsa,Salsa cremosa con curry y mango,6.35,https://images.openfoodfacts.org/images/products/871/570/041/1354/front_es.38.400.jpg
31645,Confetti Bean Pasta,Confetti Bean Pasta,6.95,https://via.placeholder.com/300x300?text=No+Image
31741,Thai Coconut Curry Hummus,Organic Thai Coconut Curry Hummus,11.52,https://images.openfoodfacts.org/images/products/085/650/000/4037/front_en.5.400.jpg
31770,Organic Tofu,"Organic tofu, handmade to a traditional Japanese recipe",12.41,https://images.openfoodfacts.org/images/products/503/446/700/0216/front_en.64.400.jpg
31811,Chicken paella,"Paella aux fruits de mer, au poulet et au Colin d'Alaska, surgelée",3.62,https://images.openfoodfacts.org/images/products/356/470/001/8453/front_fr.69.400.jpg
31813,Sesame Noodle Salad,"Savory cabbage, green cabbage, carrots, celery, green onions, cilantro, wonton noodles, sliced toasted almonds & sesame ginger dressing chopped salad kit",5.8,https://via.placeholder.com/300x300?text=No+Image
31909,Dry Spicy Salami Robusto,Quality dry spicy salami robusto - fresh grocery product,11.92,https://via.placeholder.com/300x300?text=No+Image
32139,Hommus Classic Original,Original Hommus,7.56,https://images.openfoodfacts.org/images/products/004/411/520/1013/front_en.3.400.jpg
32170,Lentil Salad,Honey Smoked Salmon & Lentil Salad,11.27,https://images.openfoodfacts.org/images/products/000/000/026/8189/front_fr.4.400.jpg
32214,Sunflower Crisp Chopped Salad,Chopped kit: sunflower crisp,7.64,https://images.openfoodfacts.org/images/products/007/127/930/9064/front_en.21.400.jpg
32275,Cabrese Salame,Quality cabrese salame - fresh grocery product,11.69,https://via.placeholder.com/300x300?text=No+Image
32291,Jalapeno Bologna,"Jalapeno red pepper spicy bologna with variety meats, jalapeno red pepper",8.37,https://via.placeholder.com/300x300?text=No+Image
32343,Bianco D'oro Italian Dry Salame,Uncured Bianco D’Oro Italian Dry Salame,6.75,https://images.openfoodfacts.org/images/products/004/242/116/2899/front_en.3.400.jpg
32369,Uncured Diced Pancetta,"Primo Naturale, Uncured Diced Pancetta",8.53,https://via.placeholder.com/300x300?text=No+Image
