product_id,product_name,description,price,image_url
29015,Honey Bunches of Oats Roasted Oats,Honey Bunches of oats honey roasted,6.32,https://images.openfoodfacts.org/images/products/088/491/235/9155/front_en.3.400.jpg
29081,Special K Cookies & Crème Pastry Crisps,Quality special k cookies & crème pastry crisps - fresh grocery product,9.3,https://via.placeholder.com/300x300?text=No+Image
29092,Organic Hearty Morning Fiber Cereal,Organic Hearty Morning Fiber Cereal,11.07,https://images.openfoodfacts.org/images/products/002/190/845/5525/front_en.22.400.jpg
29280,Breakfast On The Go! Berry Nut Blend Nut & Granola Mix,Quality breakfast on the go! berry nut blend nut & granola mix - fresh grocery product,2.06,https://via.placeholder.com/300x300?text=No+Image
29281,Natural Atrisan Granola Original,Quality natural atrisan granola original - fresh grocery product,9.81,https://via.placeholder.com/300x300?text=No+Image
29322,Berries & Cherries Muesli,Muesli Berries & Cherries,11.56,https://images.openfoodfacts.org/images/products/000/002/047/2610/front_en.24.400.jpg
29363,Cinnamon Cereal,Cinnamon & Raisin Bagels,4.31,https://images.openfoodfacts.org/images/products/502/036/401/0144/front_en.30.400.jpg
29429,Crunch Berries Cereal,Love Crunch Dark Chocolate & Red Berries Granola,5.25,https://images.openfoodfacts.org/images/products/005/844/977/1807/front_en.32.400.jpg
29485,Complete Original Pancake Mix,Original complete pancake and waffle mix imp,9.81,https://images.openfoodfacts.org/images/products/003/000/065/0707/front_en.22.400.jpg
29528,Honey & Almonds Instant Oatmeal,Quaker Instant Oatmeal Honey Almond 1.76 Ounce Plastic Cup,3.62,https://images.openfoodfacts.org/images/products/003/000/031/9574/front_en.3.400.jpg
29646,Sweet & Salty Nut Peanut Granola Bars,Chewy granola bars with peanuts,9.78,https://images.openfoodfacts.org/images/products/001/600/027/7076/front_en.22.400.jpg
29660,"Frosted Toaster Pastries, Cherry Pomegran","Quality frosted toaster pastries, cherry pomegran - fresh grocery product",14.61,https://via.placeholder.com/300x300?text=No+Image
29686,EnviroKidz Glute Free & Wheat Free Chocolate Crispy Rice Bars,Quality envirokidz glute free & wheat free chocolate crispy rice bars - fresh grocery product,10.46,https://via.placeholder.com/300x300?text=No+Image
29687,Cereals Simply Delicious Muesli A Classic Muesli,Quality cereals simply delicious muesli a classic muesli - fresh grocery product,12.9,https://via.placeholder.com/300x300?text=No+Image
29742,Organic Toaster Pastries Frosted Lotta Chocolotta - 6 CT,Quality organic toaster pastries frosted lotta chocolotta - 6 ct - fresh grocery product,14.28,https://via.placeholder.com/300x300?text=No+Image
29752,Gluten Free Foods Granola,Berry Burst Gluten Free Granola,11.31,https://images.openfoodfacts.org/images/products/506/085/364/0315/front_en.3.400.jpg
29835,Post Selects Banana Nut Crunch,Quality post selects banana nut crunch - fresh grocery product,4.53,https://via.placeholder.com/300x300?text=No+Image
29908,Power Cakes Flapjack and Waffle Mix,Power cakes flapjack & waffle mix dark chocolate,1.64,https://images.openfoodfacts.org/images/products/070/559/901/2198/front_en.40.400.jpg
29942,Gluten Free Oatmeal Apple Pieces and Cinnamon with Flax & Chia,Quality gluten free oatmeal apple pieces and cinnamon with flax & chia - fresh grocery product,12.04,https://via.placeholder.com/300x300?text=No+Image
29955,Certified Organic Pure Maple Sugar,Quality certified organic pure maple sugar - fresh grocery product,11.53,https://via.placeholder.com/300x300?text=No+Image
30066,Classic Granola,Classic Granola,4.83,https://images.openfoodfacts.org/images/products/067/562/550/7151/front_fr.6.400.jpg
30104,Bumpers Peanut Butter Cereal,Mother's Bumpers Peanut Butter Crunchy Corn Cereal 12.3 Ounce Box,11.28,https://via.placeholder.com/300x300?text=No+Image
30157,Bisquick Heart Smart Pancake & Baking Mix,Betty Crocker Heart Smart Bisquick Pancake & Baking Mix,5.55,https://images.openfoodfacts.org/images/products/001/600/042/1707/front_en.3.400.jpg
30172,Buttermilk Biscuit Mix,"Buttermilk pancake & waffle mix, buttermilk",1.75,https://images.openfoodfacts.org/images/products/003/997/811/8806/front_en.7.400.jpg
30183,Quaker Life Cinnamon Cereal,Life multigrain cereal cinnamon,5.7,https://images.openfoodfacts.org/images/products/003/000/006/3224/front_en.12.400.jpg
30199,Organic Flip for Flapjacks Pancake Mix,Quality organic flip for flapjacks pancake mix - fresh grocery product,11.87,https://via.placeholder.com/300x300?text=No+Image
30218,Peanut Butter Granola Bar,Granola bars with peanut butter,9.26,https://images.openfoodfacts.org/images/products/001/600/026/4700/front_en.32.400.jpg
30264,Apple Pie Instant Oatmeal,Quality apple pie instant oatmeal - fresh grocery product,8.03,https://via.placeholder.com/300x300?text=No+Image
30276,Power O's Toasted Cereal Original,Quality power o's toasted cereal original - fresh grocery product,2.5,https://via.placeholder.com/300x300?text=No+Image
30301,Coco Roos Cereal,Sweetened corn puff cereal with real cocoa,8.26,https://via.placeholder.com/300x300?text=No+Image
30323,Apple Cinnamon Hot Oatmeal,Quality apple cinnamon hot oatmeal - fresh grocery product,14.88,https://via.placeholder.com/300x300?text=No+Image
30340,Oatmeal Squares Brown Sugar,Soft baked oatmeal squares with cinnamon and brown sugar,3.14,https://images.openfoodfacts.org/images/products/001/600/045/8987/front_en.19.400.jpg
30435,Apple Dapples Cereal,"Weis, apple dapples, sweetened multi-grain cereal",5.65,https://via.placeholder.com/300x300?text=No+Image
30591,Cinnamon Brown Sugar Breakfast Biscuits,Belvita breakfast cinnamon brown sugar,3.71,https://images.openfoodfacts.org/images/products/004/400/005/7275/front_en.3.400.jpg
30593,Frosted Cherry Pop-Tarts Toaster Pastries,"Frosted cherry toaster pastries, cherry",9.43,https://via.placeholder.com/300x300?text=No+Image
30614,Organic Qia Superfood Breakfast Cereal,Quality organic qia superfood breakfast cereal - fresh grocery product,11.59,https://via.placeholder.com/300x300?text=No+Image
30661,Lower Sugar Maple & Brown Sugar Instant Oatmeal,Quaker Instant Oatmeal Lower Sugar Maple & Brown Sugar,1.94,https://images.openfoodfacts.org/images/products/003/000/056/8552/front_en.25.400.jpg
30683,Puffins Peanut Butter & Chocolate Cereal,Quality puffins peanut butter & chocolate cereal - fresh grocery product,5.75,https://via.placeholder.com/300x300?text=No+Image
30701,Sweet & Salty Nut Chocolate Pretzel Nut Granola Bars,Sweet & salty chocolate pretzel nut granola bars,9.49,https://via.placeholder.com/300x300?text=No+Image
30727,Vanilla Almond Fit Granola,Quality vanilla almond fit granola - fresh grocery product,8.69,https://via.placeholder.com/300x300?text=No+Image
30819,Muesli Cereal,Mélange biologique de céréales et de fruits,8.01,https://images.openfoodfacts.org/images/products/322/982/078/2560/front_fr.195.400.jpg
30836,Organic Belgian Pancake And Waffle Mix,"Waffle lady, organic belgian pancake & waffle mix",2.76,https://via.placeholder.com/300x300?text=No+Image
30879,Marshmallow Mateys Cereal,MarshmAllow mateys,3.68,https://images.openfoodfacts.org/images/products/004/240/001/6175/front_en.5.400.jpg
30884,Island Vanilla Cereal,Island Vanilla,2.72,https://images.openfoodfacts.org/images/products/001/862/770/3358/front_en.15.400.jpg
30967,Organic Frosted Flakes Cereal,Fruit Juice Corn Flakes Cereal,5.62,https://images.openfoodfacts.org/images/products/005/844/960/0572/front_en.11.400.jpg
31015,Old Country Style Muesli Cereal,Old Country Style Muesli,9.66,https://images.openfoodfacts.org/images/products/003/997/801/1039/front_en.4.400.jpg
31041,Envirokidz Chocolate Koala Crisp,Koala Crisp Chocolate Cereal,14.18,https://images.openfoodfacts.org/images/products/005/844/986/0037/front_en.21.400.jpg
31096,Gluten Free Nutty Cranberry Maple Granola,Quality gluten free nutty cranberry maple granola - fresh grocery product,9.85,https://via.placeholder.com/300x300?text=No+Image
31139,Chocolate Granola Cereal,Granola chocolat,8.14,https://images.openfoodfacts.org/images/products/322/982/079/8110/front_fr.124.400.jpg
31152,Honey Sunshine Cereal,You Are Sunshine Honey Nut Cereal Oohs milk chocolate bar,14.39,https://images.openfoodfacts.org/images/products/008/101/411/0572/front_en.3.400.jpg
31172,Old Fashioned Oat Bran Hot Cereal,Quality old fashioned oat bran hot cereal - fresh grocery product,13.98,https://via.placeholder.com/300x300?text=No+Image
31198,Mixed Berry Almond Gluten Free Chex Granola Mix,Quality mixed berry almond gluten free chex granola mix - fresh grocery product,5.74,https://via.placeholder.com/300x300?text=No+Image
31212,Organic Cranberry Almond Granola Clusters,"New England Naturals, Organic Granola Clusters, Cranberry Almond",3.03,https://via.placeholder.com/300x300?text=No+Image
31226,Organic Original Instant Oatmeal,"Instant Oatmeal, Original",14.96,https://images.openfoodfacts.org/images/products/001/111/071/9072/front_en.3.400.jpg
31271,Gluten Free Strawberry Brown Sugar with Flax Instant Oatmeal,Quality gluten free strawberry brown sugar with flax instant oatmeal - fresh grocery product,5.81,https://via.placeholder.com/300x300?text=No+Image
31277,Rice Puffs Cereal,Nature's path,7.2,https://images.openfoodfacts.org/images/products/005/844/962/0013/front_en.9.400.jpg
31310,Chocolate Coated Coconut Protein Bar,plant based protein bar with cashew coconut and chia (chocolate coated),2.03,https://images.openfoodfacts.org/images/products/380/023/298/4966/front_en.7.400.jpg
31383,"Cereal, Superfood, Hemp & Greens","Wegmans, organic hemp & greens superfood cereal",2.89,https://via.placeholder.com/300x300?text=No+Image
31389,Pistachio Granola,Crispy Crunchy Granola Pistachios Almonds Chia Seeds & a hint of Vanilla,12.31,https://images.openfoodfacts.org/images/products/941/476/300/3153/front_en.7.400.jpg
31403,Raisin Bran with Cranberries Cereal,Quality raisin bran with cranberries cereal - fresh grocery product,10.84,https://via.placeholder.com/300x300?text=No+Image
31414,Cinnamon Crunch,Cinnamon Toast Keto Friendly Cereal,5.0,https://images.openfoodfacts.org/images/products/085/001/746/8177/front_en.18.400.jpg
31433,Organic Cinnamon Crunch Cereal,Cinnamon Crunch Cereal,12.94,https://images.openfoodfacts.org/images/products/002/190/845/5563/front_en.3.400.jpg
31472,Chocolate Banana Granola Mix,Quality chocolate banana granola mix - fresh grocery product,7.09,https://via.placeholder.com/300x300?text=No+Image
31519,Gluten Free Strawberry Breakfast Bars,Quality gluten free strawberry breakfast bars - fresh grocery product,14.34,https://via.placeholder.com/300x300?text=No+Image
31556,Banana Nut Cereal,Great Grains Cereal Banana Nut Crunch,9.67,https://images.openfoodfacts.org/images/products/088/491/211/6505/front_en.15.400.jpg
31602,Steel Cut Oatmeal Blueberries and Cranberries,"Steel cut instant oatmeal, blueberries & cranberries",14.81,https://via.placeholder.com/300x300?text=No+Image
31634,Brown Sugar Maple Oatmeal with Ancient Grains,Quality brown sugar maple oatmeal with ancient grains - fresh grocery product,11.28,https://via.placeholder.com/300x300?text=No+Image
31640,Original Puffins Cereal,Puffins Cereal Original,7.94,https://images.openfoodfacts.org/images/products/007/061/720/6096/front_en.4.400.jpg
31663,Vanilla Blueberry Clusters With Flax Seeds Granola,Quality vanilla blueberry clusters with flax seeds granola - fresh grocery product,13.82,https://via.placeholder.com/300x300?text=No+Image
31670,Buttermilk Complete Pancake Mix,HUNGRY JACK - Complete Buttermilk Pancake Mix and Waffle Mix,1.9,https://images.openfoodfacts.org/images/products/001/330/028/0645/front_en.3.400.jpg
31753,Blueberry Pancake & Waffle Mix,"Blueberry complete pancake & waffle mix, blueberry",1.0,https://via.placeholder.com/300x300?text=No+Image
31759,Cherrios Honey Nut,Honey nut cherrios,2.99,https://images.openfoodfacts.org/images/products/001/600/019/3048/front_en.3.400.jpg
31760,Crunchy Nut Golden Honey Nut Flakes Cereal,Quality crunchy nut golden honey nut flakes cereal - fresh grocery product,9.85,https://via.placeholder.com/300x300?text=No+Image
31885,Organic Chewy Blueberry Almond Granola & Seed Bars,Quality organic chewy blueberry almond granola & seed bars - fresh grocery product,7.81,https://via.placeholder.com/300x300?text=No+Image
31910,"Steel Cut Oats with Currants, Flax and Chia","Quality steel cut oats with currants, flax and chia - fresh grocery product",1.37,https://via.placeholder.com/300x300?text=No+Image
31932,"Protein & Fiber Madagascar Vanilla, Almonds & Pecans Hot Oatmeal","Madagascar vanilla, almonds, pecans protein & fiber hot oatmeal, madagascar vanilla, almonds, pecans",3.63,https://images.openfoodfacts.org/images/products/075/365/671/1874/front_en.3.400.jpg
31988,Oatmeal Square Banana Dark Chocolate,Soft-baked banana bread and dark chocolate oatmeal squares,14.1,https://images.openfoodfacts.org/images/products/001/600/048/5525/front_fr.3.400.jpg
32071,Cereal Comet Crispies,Chocolate comet crispies,12.74,https://via.placeholder.com/300x300?text=No+Image
32140,Organic Maple Cinnamon Waffles,"Waffles, Maple Cinnamon",6.46,https://images.openfoodfacts.org/images/products/005/844/959/0668/front_en.10.400.jpg
32167,Oats 'N Dark Chocolate Protein Granola,Nature Valley Oats 'n Dark Chocolate Protein Granola,5.86,https://images.openfoodfacts.org/images/products/001/600/043/7784/front_en.25.400.jpg
32279,"Rolled Oats, Old Fashioned",Rolled oats,3.61,https://images.openfoodfacts.org/images/products/003/000/001/0402/front_en.95.400.jpg
32284,Vanilla Almond Pecan Oatmeal Bowl,Quality vanilla almond pecan oatmeal bowl - fresh grocery product,4.0,https://via.placeholder.com/300x300?text=No+Image
32326,Variety Pack Cereal,Premium variety pack cereal - high quality grocery product,2.82,https://images.openfoodfacts.org/images/products/359/671/038/9964/front_fr.89.400.jpg
32373,Apple Cinnamon Pecan Oatmeal Cup,Superfood Oatmeal Cup - Apple Cinnamon Pecan,14.85,https://images.openfoodfacts.org/images/products/081/058/903/1711/front_en.22.400.jpg
32423,Chocolate Delight Granola,Gluten Free Chocolate Delight Granola,13.64,https://via.placeholder.com/300x300?text=No+Image
32436,Original Granola,Biscuits sablés nappés de chocolat au lait,1.51,https://images.openfoodfacts.org/images/products/762/221/060/1988/front_en.168.400.jpg
32535,Maple Brown Sugar Squarefuls Cereal,Quality maple brown sugar squarefuls cereal - fresh grocery product,2.92,https://via.placeholder.com/300x300?text=No+Image
32544,Corn Chex Gluten Free,Chex cereal gluten free corn,10.5,https://images.openfoodfacts.org/images/products/001/600/048/7963/front_en.12.400.jpg
32579,Organic Promise Autumn Wheat Cereal,Organic Promise Autumn Wheat Cereal,12.13,https://images.openfoodfacts.org/images/products/001/862/770/3129/front_en.17.400.jpg
32620,Powdered Sugar Mini Donuts,"Tastykake, mini donuts, powdered sugar",10.0,https://images.openfoodfacts.org/images/products/002/560/000/7860/front_en.5.400.jpg
32627,Cereals Super Cranberry Cherry & Almond Muesli Fruity & Tangy With Almonds,Quality cereals super cranberry cherry & almond muesli fruity & tangy with almonds - fresh grocery product,9.62,https://via.placeholder.com/300x300?text=No+Image
32648,Gluten Free Honey Almond Granola,Apple & Almond Gluten Free Honey Granola,5.1,https://via.placeholder.com/300x300?text=No+Image
32683,Oats Select Starts Gluten Free Quick 1-Minute,Quality oats select starts gluten free quick 1-minute - fresh grocery product,8.72,https://via.placeholder.com/300x300?text=No+Image
32705,Gluten Free Oatmeal Brown Sugar and Maple with Flax & Chia,Quality gluten free oatmeal brown sugar and maple with flax & chia - fresh grocery product,12.94,https://via.placeholder.com/300x300?text=No+Image
32726,Cranberry Gourmet Granola,Power Granola Cranberry Nutty Crunch,3.69,https://via.placeholder.com/300x300?text=No+Image
32762,Nutri-Grain Soft Baked Mixed Berry Cereal Breakfast Bars,Quality nutri-grain soft baked mixed berry cereal breakfast bars - fresh grocery product,1.71,https://via.placeholder.com/300x300?text=No+Image
32781,Gluten Free Sunrise Crunchy Maple Cereal,Quality gluten free sunrise crunchy maple cereal - fresh grocery product,12.17,https://via.placeholder.com/300x300?text=No+Image
32861,Organic Instant Oatmeal Light Maple Brown Sugar,Quality organic instant oatmeal light maple brown sugar - fresh grocery product,7.94,https://via.placeholder.com/300x300?text=No+Image
32890,Greek Yogurt Mixed Berry Protein Chewy Bars,"Greek Yogurt Protein Chewy Bars, Mixed Berry",9.42,https://via.placeholder.com/300x300?text=No+Image
32892,"Muesli, Ancient Grain, Cranberry Cashew","Quality muesli, ancient grain, cranberry cashew - fresh grocery product",11.9,https://via.placeholder.com/300x300?text=No+Image
32942,Frontier Whole Wheat Oat & Honey Flapjack and Waffle Mix,Quality frontier whole wheat oat & honey flapjack and waffle mix - fresh grocery product,12.88,https://via.placeholder.com/300x300?text=No+Image
32945,Renola Cocoa Coconut Fruit Nut and Seed Mix,Quality renola cocoa coconut fruit nut and seed mix - fresh grocery product,7.55,https://via.placeholder.com/300x300?text=No+Image
32958,Frosted Flakes Cereal Single Serve,Quality frosted flakes cereal single serve - fresh grocery product,14.03,https://via.placeholder.com/300x300?text=No+Image
33058,Organic Strawberry Cobbler Cereal Bars,Quality organic strawberry cobbler cereal bars - fresh grocery product,6.16,https://via.placeholder.com/300x300?text=No+Image
33068,Qi'a Chia Cranberry Vanilla Buckwheat And Hemp Cereal,"Qi'a Superfood Chia, Buckwheat & Hemp Topper - Cranberry Vanilla",14.31,https://via.placeholder.com/300x300?text=No+Image
33078,Frosted Mini-Wheats Touch of Fruit Raspberry Cereal,Quality frosted mini-wheats touch of fruit raspberry cereal - fresh grocery product,10.76,https://via.placeholder.com/300x300?text=No+Image
33230,Gluten Free Extreme Fruit & Nut Granola,Quality gluten free extreme fruit & nut granola - fresh grocery product,5.52,https://via.placeholder.com/300x300?text=No+Image
33331,Cinnamon Toast Crunch Crispy Sweetened Whole Wheat & Rice Cereal,"Crispy, Sweetened Whole Wheat & Rice Cereal",3.02,https://via.placeholder.com/300x300?text=No+Image
33388,Gluten Free Baking and Pancake Mix,Gluten Free Pancake Mix,4.14,https://images.openfoodfacts.org/images/products/007/101/207/5034/front_en.20.400.jpg
33449,Simply Delicious Gluten Free Cereal Cocoa Sensation,Quality simply delicious gluten free cereal cocoa sensation - fresh grocery product,10.44,https://via.placeholder.com/300x300?text=No+Image
33460,Real Medleys Super Grains Banana Walnut Oatmeal Cup,Quality real medleys super grains banana walnut oatmeal cup - fresh grocery product,2.5,https://via.placeholder.com/300x300?text=No+Image
33552,Real Medleys Peach Almond Oatmeal,Quaker Real Medleys Peach Almond Oatmeal 2.64 Ounce Cup,7.84,https://via.placeholder.com/300x300?text=No+Image
33563,Oatmeal to Go Brown Sugar Cinnamon,Quaker Oatmeal to Go Brown Sugar Cinnamon Breakfast Bars(6-2.1 oz)Ounce 6 Count Box,6.54,https://via.placeholder.com/300x300?text=No+Image
33590,No Sugar Added Muesli Cereal,Mélange biologique de céréales et de fruits,11.48,https://images.openfoodfacts.org/images/products/322/982/078/2560/front_fr.195.400.jpg
33645,Tasteeos Cereal,Whole Grain Oat cereal,3.9,https://images.openfoodfacts.org/images/products/079/166/937/5072/front_en.8.400.jpg
33686,Qi'a Gluten Free Oatmeal Creamy Coconut,Quality qi'a gluten free oatmeal creamy coconut - fresh grocery product,2.97,https://via.placeholder.com/300x300?text=No+Image
33745,Oats and Honey Protein Crunchy Granola,Oats 'n Honey Protein Granola,2.25,https://images.openfoodfacts.org/images/products/006/563/319/6391/front_en.21.400.jpg
33814,Homestyle Oatmeal,Gluten Free Homestyle Instant Oatmeal,9.91,https://images.openfoodfacts.org/images/products/005/844/945/0658/front_en.8.400.jpg
33851,Organic Steel Cut Oats Hot Cereal,Quality organic steel cut oats hot cereal - fresh grocery product,2.7,https://via.placeholder.com/300x300?text=No+Image
33874,Fruit & Cream Instant Oatmeal Variety Pack,Instant Oatmeal fruit and cream variety pack,6.49,https://images.openfoodfacts.org/images/products/003/000/056/8286/front_en.15.400.jpg
34019,Organic Buckwheat Pancake & Waffle Mix,Made With Organic Flour Buckwheat Pancake & Waffle Mix,2.13,https://images.openfoodfacts.org/images/products/003/997/801/8816/front_en.4.400.jpg
34027,Crispix Rice & Corn Cereal,Crispix Delicious Toasted Rice And Crunchy Corn Cereal,13.08,https://images.openfoodfacts.org/images/products/006/410/035/8034/front_en.15.400.jpg
34079,Oatmeal Blueberry & Hazelnut Cup,Quality oatmeal blueberry & hazelnut cup - fresh grocery product,6.96,https://via.placeholder.com/300x300?text=No+Image
34082,Chia Seed,Whole Chia Seeds,10.2,https://images.openfoodfacts.org/images/products/408/860/027/2696/front_en.44.400.jpg
34144,Whole Grain Buttermilk Pancake & Waffle Mix,100% whole grains power cakes pancake & waffle mix buttermilk,6.83,https://images.openfoodfacts.org/images/products/070/559/901/2792/front_en.8.400.jpg
34173,Simply Pure Chia Hot Cereal Blend,Quality simply pure chia hot cereal blend - fresh grocery product,1.35,https://via.placeholder.com/300x300?text=No+Image
34247,Real Medleys Blueberry Hazelnut Oatmeal,Quality real medleys blueberry hazelnut oatmeal - fresh grocery product,10.04,https://via.placeholder.com/300x300?text=No+Image
34303,Blueberry Banana Walnut Hot Oats,Quality blueberry banana walnut hot oats - fresh grocery product,11.77,https://via.placeholder.com/300x300?text=No+Image
34307,Special K Chocolatey Strawberry Cereal,"Special k, crunchy rice & wheat flakes cereal, chocolatey strawberry, chocolatey strawberry",2.03,https://via.placeholder.com/300x300?text=No+Image
34322,Nourish Multi-Grain Maple Brown Sugar Crunch Hot Cereal,Quality nourish multi-grain maple brown sugar crunch hot cereal - fresh grocery product,11.41,https://via.placeholder.com/300x300?text=No+Image
34378,Cinnamon Granola Crunch,Cinnamon Granola Crunch,4.66,https://images.openfoodfacts.org/images/products/409/910/002/9376/front_en.3.400.jpg
34409,Organic Quinoa & Apple Baby Cereal,"Organic Baby Cereal, Quinoa + Apple",3.54,https://via.placeholder.com/300x300?text=No+Image
34469,Oat Bran,Original Heart Healthy Oatbran,7.69,https://images.openfoodfacts.org/images/products/501/002/651/2840/front_en.4.400.jpg
34488,Savory Blend Handmade Granola,Quality savory blend handmade granola - fresh grocery product,12.68,https://via.placeholder.com/300x300?text=No+Image
34503,Grape-Nuts Cereal,Premium grape-nuts cereal - high quality grocery product,6.85,https://images.openfoodfacts.org/images/products/088/491/200/4710/front_en.41.400.jpg
34548,Instant Oatmeal Golden & Brown Raisins with Almonds,Quality instant oatmeal golden & brown raisins with almonds - fresh grocery product,12.4,https://via.placeholder.com/300x300?text=No+Image
34565,Peanut Butter Whole Grain Clusters,Quality peanut butter whole grain clusters - fresh grocery product,12.54,https://via.placeholder.com/300x300?text=No+Image
34657,Cinnamon Crunch Snackimals Cereal,"Snackimals, organic cereal, cinnamon crunch, cinnamon crunch",4.39,https://via.placeholder.com/300x300?text=No+Image
34666,Gluten Free & Non-Dairy Pancake And Waffle Mix,Quality gluten free & non-dairy pancake and waffle mix - fresh grocery product,8.12,https://via.placeholder.com/300x300?text=No+Image
34719,Flax & Chia Oatmeal,Gluten Free Oatmeal With Flax & Chia,5.01,https://images.openfoodfacts.org/images/products/003/997/803/1846/front_en.25.400.jpg
34755,Maple Pecan,"Hazelnut, Pecan & Maple Oat Bars",11.82,https://images.openfoodfacts.org/images/products/506/048/284/1992/front_en.23.400.jpg
34814,10 Grain Pancake & Waffle Mix,Mezcla para pancakes,8.11,https://images.openfoodfacts.org/images/products/003/997/811/2040/front_en.34.400.jpg
34851,Strawberry Fig Bars,Fig Bar Strawberry,3.46,https://images.openfoodfacts.org/images/products/004/749/512/0011/front_en.8.400.jpg
34987,Blueberry Granola,Blueberry Cinnamon Nut Granola,6.45,https://images.openfoodfacts.org/images/products/081/956/202/2791/front_en.66.400.jpg
35008,Disney Frozen Cereal,Céréales soufflées goût vanille,5.54,https://images.openfoodfacts.org/images/products/505/382/713/8802/front_fr.8.400.jpg
35081,Eco Pac Organic Corn Puffs,Quality eco pac organic corn puffs - fresh grocery product,2.21,https://via.placeholder.com/300x300?text=No+Image
35156,Oat Revolution! Maple & Brown Sugar Instant Oatmeal,Quality oat revolution! maple & brown sugar instant oatmeal - fresh grocery product,11.84,https://via.placeholder.com/300x300?text=No+Image
35193,"Post Selects Great Grains Cereal Raisins, Dates and Pecans","Quality post selects great grains cereal raisins, dates and pecans - fresh grocery product",8.54,https://via.placeholder.com/300x300?text=No+Image
35250,Gluten-Free Cranberry Apple with Walnut & Cinnamon Instant Oatmeal,Quality gluten-free cranberry apple with walnut & cinnamon instant oatmeal - fresh grocery product,12.42,https://via.placeholder.com/300x300?text=No+Image
35285,Gluten-Free Steel Cut Oats,Steel Cut Oats organic Gluten Free,3.21,https://images.openfoodfacts.org/images/products/064/667/046/2597/front_en.16.400.jpg
35306,Gluten Free Organic Peanut Butter & Chocolate Cereal,Quality gluten free organic peanut butter & chocolate cereal - fresh grocery product,8.9,https://via.placeholder.com/300x300?text=No+Image
35353,Dino Eggs Instant Oatmeal,Quaker Instant Oatmeal Dino Eggs Brown Sugar,13.66,https://images.openfoodfacts.org/images/products/005/557/710/3661/front_en.19.400.jpg
35400,Gluten Free Baking & Packing Mix,Quality gluten free baking & packing mix - fresh grocery product,1.83,https://via.placeholder.com/300x300?text=No+Image
