product_id,product_name,description,price,image_url
32381,Lebanon Bologna,Sweet Lebanon Bologna,11.02,https://images.openfoodfacts.org/images/products/002/055/911/3082/front_en.4.400.jpg
32418,Smoked Honey Ham,Ham smoked honey & maple flavour,9.79,https://images.openfoodfacts.org/images/products/006/148/304/0211/front_en.16.400.jpg
32442,Organic Original Tofu Veggie Burger,Quality organic original tofu veggie burger - fresh grocery product,13.36,https://via.placeholder.com/300x300?text=No+Image
32507,Vegetable Combo Sp,Vegetable combo sp,2.76,https://images.openfoodfacts.org/images/products/002/301/290/1349/front_en.8.400.jpg
32528,Spicy Tuna Avocado,"Imitation crab, cucumber, avocado, spicy tuna, tuna & salmon",7.83,https://via.placeholder.com/300x300?text=No+Image
32584,Honey Ham & Smoked White Turkey Sub Sandwich Kit,Quality honey ham & smoked white turkey sub sandwich kit - fresh grocery product,14.62,https://via.placeholder.com/300x300?text=No+Image
32604,Bbq Chicken Wings,Kansas City Style BBQ Chicken Wings,4.86,https://via.placeholder.com/300x300?text=No+Image
32608,Organic Cranberry Winter Salad,Quality organic cranberry winter salad - fresh grocery product,7.85,https://via.placeholder.com/300x300?text=No+Image
32636,Roasted Garlic Hummus with Pretzels,Quality roasted garlic hummus with pretzels - fresh grocery product,3.29,https://via.placeholder.com/300x300?text=No+Image
32642,Roasted Chicken Breast,"Sliced, seasoned, cooked and roasted chicken breast fillet pieces",13.38,https://images.openfoodfacts.org/images/products/505/700/892/0361/front_en.27.400.jpg
32749,Sweet Corn Roasted Chile Tamale,Quality sweet corn roasted chile tamale - fresh grocery product,5.4,https://via.placeholder.com/300x300?text=No+Image
32752,Minis Pepperoni,"Stonebaked pizza base topped with seasoned tomato sauce, mozzarella cheese, pepperoni, mini pepperoni and coloured Cheddar cheese",9.84,https://images.openfoodfacts.org/images/products/505/717/203/0286/front_en.20.400.jpg
32757,Quiche Lorraine,Quiche Lorraine pur beurre,1.19,https://images.openfoodfacts.org/images/products/324/883/000/0587/front_fr.25.400.jpg
32772,Shrimp Ceviche,Shrimp ceviche,13.55,https://images.openfoodfacts.org/images/products/004/029/551/1720/front_en.3.400.jpg
32821,Zen Salad,Premium zen salad - high quality grocery product,11.96,https://via.placeholder.com/300x300?text=No+Image
32828,Italian Sausage,Italian Milano Salami,13.94,https://images.openfoodfacts.org/images/products/505/290/945/9248/front_en.16.400.jpg
32837,Ham Off The Bone,Off The Bone Smokehouse Ham Deli Sliced,10.91,https://images.openfoodfacts.org/images/products/001/111/060/2534/front_en.5.400.jpg
32846,Babaghannouj,CONSERVES MODERNES CHTAURA - Babaghannouj 175 GR,2.71,https://images.openfoodfacts.org/images/products/528/300/320/1017/front_en.27.400.jpg
32855,Turkey Variety Pack,2 lb. Variety Pack Oven Roasted Turkey Breast & Uncured Honey Ham,14.47,https://images.openfoodfacts.org/images/products/004/450/096/6879/front_en.9.400.jpg
32862,Vegan Mac N Cheese,Dairy-Free Cheddar Mac & Cheese,10.53,https://images.openfoodfacts.org/images/products/087/145/900/1333/front_en.23.400.jpg
32878,Clam Chowder,Chunky New England Clam Chowder,13.47,https://images.openfoodfacts.org/images/products/005/100/000/5243/front_en.18.400.jpg
32900,Paneer Tikka Masala,Paneer Tikka Masala with Spinach Basmati Rice,2.03,https://images.openfoodfacts.org/images/products/000/000/099/1438/front_en.21.400.jpg
32915,Honey Turkey,"Deli select, ultra thin honey roasted turkey breast",6.29,https://images.openfoodfacts.org/images/products/004/450/097/6519/front_en.5.400.jpg
32936,Sensational Sides Loaded Mashed Potatoes,Quality sensational sides loaded mashed potatoes - fresh grocery product,11.98,https://via.placeholder.com/300x300?text=No+Image
32949,Organic Medium Mexicana Salsa,Quality organic medium mexicana salsa - fresh grocery product,11.25,https://via.placeholder.com/300x300?text=No+Image
33006,Mediterranean Platter,Mediterranean Inspired Platter,1.58,https://images.openfoodfacts.org/images/products/505/440/205/5279/front_en.14.400.jpg
33014,Pork Roll,Great british pork sausage rolls,9.03,https://images.openfoodfacts.org/images/products/506/013/625/3812/front_en.12.400.jpg
33015,Gluten Free Organic Soyrizo,Quality gluten free organic soyrizo - fresh grocery product,6.34,https://via.placeholder.com/300x300?text=No+Image
33016,Chef Salad,Salade de pomme de terre,2.4,https://images.openfoodfacts.org/images/products/405/648/912/9875/front_en.87.400.jpg
33045,Lemon Herb Chicken Breast,Taste the difference lemon & herb chicken breast schnitzel,8.3,https://via.placeholder.com/300x300?text=No+Image
33070,Cooked Sliced Deli Ham,Cooked and sliced chicken,3.76,https://images.openfoodfacts.org/images/products/505/754/586/4302/front_en.43.400.jpg
33071,Sashimi Combo,9pc sashimi combo,5.47,https://via.placeholder.com/300x300?text=No+Image
33095,"Salame, Italian Dry",Reduced sodium italian dry salame,9.33,https://images.openfoodfacts.org/images/products/007/300/710/1957/front_en.3.400.jpg
33106,Organic Firm Tofu,Organic Super Firm Tofu,12.57,https://images.openfoodfacts.org/images/products/406/146/357/8013/front_en.38.400.jpg
33111,Sweet & Salty Caramel,Duo aus einer gefüllten Vollmilchschokolade mit einer Brownie-Kakaocreme (24%) und einer salzigen Karamellfüllung (21%),1.56,https://images.openfoodfacts.org/images/products/400/041/766/3313/front_de.5.400.jpg
33129,Classic Hummus,Premium classic hummus - high quality grocery product,14.26,https://images.openfoodfacts.org/images/products/408/860/000/3429/front_en.58.400.jpg
33156,Seitan wheat Strips,Seitan Wheat Protein Strips,3.0,https://via.placeholder.com/300x300?text=No+Image
33192,Fat Free Veggie Dogs,Quality fat free veggie dogs - fresh grocery product,6.95,https://via.placeholder.com/300x300?text=No+Image
33228,Lunchables Lunch Combinations Pepperoni & Mozzarella,Quality lunchables lunch combinations pepperoni & mozzarella - fresh grocery product,8.59,https://via.placeholder.com/300x300?text=No+Image
33276,Kalamata Olive Spread,Kalamata Olive Tapenade,3.15,https://images.openfoodfacts.org/images/products/000/000/045/8306/front_en.3.400.jpg
33308,Beet Hummus,Beet Hummus,8.02,https://images.openfoodfacts.org/images/products/006/038/316/2238/front_en.6.400.jpg
33399,Red Lentil Dahl Soup,"Organic red lentil dahl soup, red lentil dahl",8.19,https://via.placeholder.com/300x300?text=No+Image
33421,Blackened Turkey,Blackened turkey breast,5.12,https://images.openfoodfacts.org/images/products/022/025/270/6325/front_en.3.400.jpg
33523,Liverwurst,Veganes Erzeugnis nach Art einer Leberwurst mit Schnittlauch auf Basis von Erbsen,1.91,https://images.openfoodfacts.org/images/products/400/040/500/2360/front_de.28.400.jpg
33534,Scalloped with Gruyere Cheese Potatoes,Scalloped Potatoes With Gruyere Cheese,11.21,https://via.placeholder.com/300x300?text=No+Image
33537,Fig And Olive Spread,Quality fig and olive spread - fresh grocery product,1.69,https://via.placeholder.com/300x300?text=No+Image
33620,Cranberry Relish,Cranberry Relish,11.76,https://via.placeholder.com/300x300?text=No+Image
33639,Rotisserie Seasoned Turkey Breast,Rotisserie seasoned turkey breast & white turkey,3.98,https://via.placeholder.com/300x300?text=No+Image
33677,Hard Salami Panino,Mozzarella cheese,14.07,https://via.placeholder.com/300x300?text=No+Image
33729,Casalingo Salami,Casalingo uncuredã¢â€â salami,13.47,https://images.openfoodfacts.org/images/products/085/073/200/6180/front_en.4.400.jpg
33820,Ginger Bok Choy Soba Noodles,Quality ginger bok choy soba noodles - fresh grocery product,10.05,https://via.placeholder.com/300x300?text=No+Image
33830,Smoked Shaved Ham,Shaved Black Forest Smoked Ham,7.38,https://images.openfoodfacts.org/images/products/005/565/277/7183/front_fr.9.400.jpg
33835,Organic Smoky Chipotle Hummus,Quality organic smoky chipotle hummus - fresh grocery product,2.12,https://via.placeholder.com/300x300?text=No+Image
33846,Roasted Garlic Hummus,Roasted Garlic Hummus,13.17,https://images.openfoodfacts.org/images/products/004/082/201/1242/front_en.28.400.jpg
33878,Potato Salad,Hot smoked salmon & new potato salad,4.88,https://images.openfoodfacts.org/images/products/000/000/065/9871/front_en.35.400.jpg
34002,Artisan Spinach Pesto Sausage,Quality artisan spinach pesto sausage - fresh grocery product,12.18,https://via.placeholder.com/300x300?text=No+Image
34045,Fire Roasted Medium Salsa,Fire roasted mexican red salsa medium ounce,10.85,https://images.openfoodfacts.org/images/products/003/390/750/0014/front_en.5.400.jpg
34110,Hommus Roasted Red Pepper,Organic Roasted Red Pepper Hommus With Toppings,4.35,https://images.openfoodfacts.org/images/products/004/411/540/3042/front_en.4.400.jpg
34128,Tzatziki,Premium tzatziki - high quality grocery product,13.99,https://images.openfoodfacts.org/images/products/329/207/000/7905/front_fr.124.400.jpg
34133,Chopped Southwest Salad With Dressing,"Chopped salad blend, bbq ranch dressing, southwest style white chicken meat, black beans, four cheese blend, and tortilla strips bowl, bbq seasoned ranch salad with chicken",3.39,https://via.placeholder.com/300x300?text=No+Image
34140,Tomato Basil Pesto,Tesco basil pesto and semi-dried tomato pasta,4.01,https://images.openfoodfacts.org/images/products/505/426/810/3923/front_fr.4.400.jpg
34141,Tabouli Salad,Tabouli Salad,3.09,https://via.placeholder.com/300x300?text=No+Image
34169,"Hommus, Artichoke Spinach",Artichoke Spinach Hommus,4.4,https://via.placeholder.com/300x300?text=No+Image
34237,Organic Add Me Kale Blend Bagged Salad,Quality organic add me kale blend bagged salad - fresh grocery product,8.42,https://via.placeholder.com/300x300?text=No+Image
34291,Traditional Harissa Spread in Extra Virgin Olive Oil,Quality traditional harissa spread in extra virgin olive oil - fresh grocery product,9.11,https://via.placeholder.com/300x300?text=No+Image
34306,Turkey Meatloaf With Cranberry Glaze,Quality turkey meatloaf with cranberry glaze - fresh grocery product,5.36,https://via.placeholder.com/300x300?text=No+Image
34318,Vegenaise Horseradish Sauce,Vegenaise Horseradish Sauce,11.12,https://via.placeholder.com/300x300?text=No+Image
34321,Original Pepperoni,Pepperoni Original,2.28,https://images.openfoodfacts.org/images/products/409/910/014/0415/front_en.13.400.jpg
34345,Raw Carrot Soup,Quality raw carrot soup - fresh grocery product,4.19,https://via.placeholder.com/300x300?text=No+Image
34359,French Onion No Fat Dip,"Dean's, dip, no fat, french onion",10.59,https://via.placeholder.com/300x300?text=No+Image
34415,Light Bologna & American Cracker Stackers Lunchhable,Quality light bologna & american cracker stackers lunchhable - fresh grocery product,11.43,https://via.placeholder.com/300x300?text=No+Image
34476,Lunch Bundle Superfood Trail Mix - Corn & Flax Chips - Chickpeas & Almonds - Dark Chocolate Raisins - Veggie Crisps,Quality lunch bundle superfood trail mix - corn & flax chips - chickpeas & almonds - dark chocolate raisins - veggie crisps - fresh grocery product,13.96,https://via.placeholder.com/300x300?text=No+Image
34497,"Prosciutto, Americano","La quercia, prosciutto americano cured meats",7.74,https://via.placeholder.com/300x300?text=No+Image
34547,LunchMakers Turkey Cracker Crunchers with Nestle Butterfinger Bar,Quality lunchmakers turkey cracker crunchers with nestle butterfinger bar - fresh grocery product,13.28,https://via.placeholder.com/300x300?text=No+Image
34654,Teriyaki Stir Fry Kit,Teriyaki Stir Fry Kit,11.53,https://images.openfoodfacts.org/images/products/500/012/879/3445/front_en.3.400.jpg
34750,Black Winter Truffle Butter,Black Winter Truffle Butter,5.27,https://images.openfoodfacts.org/images/products/008/957/578/9909/front_en.9.400.jpg
34769,"Roast Beef, 98% Fat Free","Quality roast beef, 98% fat free - fresh grocery product",7.86,https://via.placeholder.com/300x300?text=No+Image
34832,Wild Rice Edamame Salad,Quality wild rice edamame salad - fresh grocery product,1.96,https://via.placeholder.com/300x300?text=No+Image
34881,Baba Ghannouj,Baba Ghannouj Eggplant Dip,8.88,https://images.openfoodfacts.org/images/products/001/111/004/3528/front_en.3.400.jpg
34930,Veggie Dip,Hummus Pikant,6.92,https://images.openfoodfacts.org/images/products/406/336/716/0691/front_de.21.400.jpg
34939,Veggie Ground,Veggie Hack,5.59,https://images.openfoodfacts.org/images/products/430/561/578/3208/front_de.21.400.jpg
34941,Uncured Italian Dry Salame,Uncured Bianco D’Oro Italian Dry Salame,5.27,https://images.openfoodfacts.org/images/products/004/242/116/2899/front_en.3.400.jpg
34952,Gatherings Honey Ham Cheese & Crackers Snack Tray,Quality gatherings honey ham cheese & crackers snack tray - fresh grocery product,9.8,https://via.placeholder.com/300x300?text=No+Image
35066,Deep Dish Pizza With Pepperoni With Smoothie Lunch Combinations,Quality deep dish pizza with pepperoni with smoothie lunch combinations - fresh grocery product,4.37,https://via.placeholder.com/300x300?text=No+Image
35079,Guacamole Singles,Guacamole Classic Singles,3.64,https://images.openfoodfacts.org/images/products/004/082/234/2681/front_en.9.400.jpg
35122,Turkey Breast Thin Sliced Mesquite Smoked Deli Select,Quality turkey breast thin sliced mesquite smoked deli select - fresh grocery product,7.15,https://via.placeholder.com/300x300?text=No+Image
35144,Tartufo Salami,SALAME AL TARTUFO NERO,7.22,https://images.openfoodfacts.org/images/products/801/944/000/4853/front_fr.13.400.jpg
35194,Pre-Sliced Deli Roast Beef,Quality pre-sliced deli roast beef - fresh grocery product,9.55,https://via.placeholder.com/300x300?text=No+Image
35305,Hot El Hombre Salsa,Quality hot el hombre salsa - fresh grocery product,12.32,https://via.placeholder.com/300x300?text=No+Image
35307,Foods Dry Salami Rosette De Lyon,Quality foods dry salami rosette de lyon - fresh grocery product,3.88,https://via.placeholder.com/300x300?text=No+Image
35363,Organic Red Pepper Hommus,Organic Roasted Red Pepper Hommus With Toppings,4.58,https://images.openfoodfacts.org/images/products/004/411/540/3042/front_en.4.400.jpg
35457,Zucchini Soup,Knorr Comme à La Maison Soupe Liquide Courgette Ricotta Parmesan 45cl,14.57,https://images.openfoodfacts.org/images/products/871/120/035/0353/front_en.52.400.jpg
35495,Salsa Fresca,Salsa fresca funghi,6.53,https://images.openfoodfacts.org/images/products/840/200/101/2020/front_en.3.400.jpg
35530,Natural Mini Pork Pepperoni,Quality natural mini pork pepperoni - fresh grocery product,8.88,https://via.placeholder.com/300x300?text=No+Image
35548,Twice Baked Potatoes,Mini grilled toast - twice baked,9.81,https://images.openfoodfacts.org/images/products/318/218/000/2115/front_en.95.400.jpg
35575,Sesame Miso Chopped Salad,"Asian inspired chopped vegetable blend, white-meat chicken, edamame, wonton strips, sliced almonds & sunflower seeds with sesame ginger miso dressing salad, asian inspired chop salad",12.15,https://via.placeholder.com/300x300?text=No+Image
35610,Smoked Garlic Teriyaki,Quality smoked garlic teriyaki - fresh grocery product,5.42,https://via.placeholder.com/300x300?text=No+Image
35640,Beer Brats Sausage,Original Sausage - Beer Brat,14.96,https://images.openfoodfacts.org/images/products/002/558/311/1868/front_fr.4.400.jpg
35652,Prosciutto Di Parma,Parma ham (dry cured pork leg),1.53,https://images.openfoodfacts.org/images/products/000/000/023/6072/front_en.25.400.jpg
35670,Organic Braised Tofu,Hodo organic braised tofu,5.82,https://images.openfoodfacts.org/images/products/085/340/400/2220/front_en.4.400.jpg
35729,Turkey Meatloaf,Italian style turkey meatloaf,7.81,https://images.openfoodfacts.org/images/products/000/000/012/4621/front_en.4.400.jpg
35738,Calabrese uncured italian Salami  with pepper and paprika,Quality calabrese uncured italian salami  with pepper and paprika - fresh grocery product,3.57,https://via.placeholder.com/300x300?text=No+Image
35745,Broccoli Raisin Salad,Broccoli raisin salad,12.47,https://images.openfoodfacts.org/images/products/022/678/280/6733/front_en.3.400.jpg
35765,Slow Cured Pepper + Garlic Salame Molisana,Quality slow cured pepper + garlic salame molisana - fresh grocery product,3.81,https://via.placeholder.com/300x300?text=No+Image
35863,Typical Carribean Veggie Plate,Quality typical carribean veggie plate - fresh grocery product,7.68,https://via.placeholder.com/300x300?text=No+Image
35968,Organic Traditional Hummus,Organic Traditional Hummus,9.22,https://images.openfoodfacts.org/images/products/007/989/311/5580/front_en.6.400.jpg
35975,Sweet Corn Tamales,Sweet corn tamales,13.97,https://via.placeholder.com/300x300?text=No+Image
36032,Sopressata,Superiore sopressata,2.58,https://via.placeholder.com/300x300?text=No+Image
36087,Sliced Sopressata,Spirella Minis Sliced Mozzarella Hand Rolled With Sopressata,1.05,https://via.placeholder.com/300x300?text=No+Image
36099,Roast Beef,Roast Britanni-ahh Gravy Granules,2.87,https://images.openfoodfacts.org/images/products/500/035/491/8520/front_en.19.400.jpg
36121,Smoked White Turkey,White meat smoked turkey franks,7.46,https://images.openfoodfacts.org/images/products/005/450/010/0869/front_en.5.400.jpg
36130,Natural Choice Deli Oven Roasted Turkey,Quality natural choice deli oven roasted turkey - fresh grocery product,13.79,https://via.placeholder.com/300x300?text=No+Image
36144,Smoked Turkey Breast,Turkey Breast - Smoked,6.58,https://images.openfoodfacts.org/images/products/309/575/631/2016/front_en.322.400.jpg
36176,Black Bean Hummus,Hummus black bean,9.37,https://images.openfoodfacts.org/images/products/761/341/387/9618/front_fr.3.400.jpg
36184,Sliced Pancetta,Gemme di Pancetta,12.07,https://images.openfoodfacts.org/images/products/541/320/308/0093/front_it.8.400.jpg
36185,Breaded Chicken Dunks Lunchables,Breaded chicken dunks lunchables,6.53,https://images.openfoodfacts.org/images/products/004/470/006/3576/front_en.7.400.jpg
36190,"Salame, Sopressata",Sopressata Salame,14.6,https://via.placeholder.com/300x300?text=No+Image
36224,Ham American Sub,Club Sub Ham & Turkey With American Cheese On A Sub Bun,2.74,https://via.placeholder.com/300x300?text=No+Image
36246,Crunchy Shrimp Tempura Roll,Crunchy Shrimp Tempura Roll SP(Brown Rice),8.02,https://images.openfoodfacts.org/images/products/002/301/290/1721/front_en.3.400.jpg
36331,Buffalo Ranch Dip,Buffalo Ranch Dip,14.09,https://images.openfoodfacts.org/images/products/085/523/200/7989/front_en.3.400.jpg
36368,Meze Dip Three-Pepper Salsa Greek Yogurt,Quality meze dip three-pepper salsa greek yogurt - fresh grocery product,8.51,https://via.placeholder.com/300x300?text=No+Image
36400,Carving Board Slow Roasted Roast Beef Cured,Quality carving board slow roasted roast beef cured - fresh grocery product,5.64,https://via.placeholder.com/300x300?text=No+Image
36413,Fresh Spicy Guacamole,Guacamole spicy (pikant gewürzt),4.74,https://images.openfoodfacts.org/images/products/430/421/843/4791/front_de.29.400.jpg
36450,Twice Baked Potato,Twice Baked Potato With Bacon & Chives,6.14,https://via.placeholder.com/300x300?text=No+Image
36486,Lower Sodium Oven Roasted Turkey Breast,Deli select lower sodium oven roasted turkey breast,4.6,https://images.openfoodfacts.org/images/products/004/450/097/6441/front_en.8.400.jpg
36502,Chimichurri Hemp Tofu,"Hemp Tofu, Chimichurri",12.95,https://via.placeholder.com/300x300?text=No+Image
36587,Organic Lemon Cayenne Hummus,Quality organic lemon cayenne hummus - fresh grocery product,3.64,https://via.placeholder.com/300x300?text=No+Image
36700,Barbecue Chicken Breast,"Grills formed from marinated chunks of chicken breast, lightly fried, seared and coated with a sweet barbecue glaze",13.42,https://images.openfoodfacts.org/images/products/500/011/611/1749/front_en.12.400.jpg
36735,Organic Roasted Sliced Chicken Breast,Quality organic roasted sliced chicken breast - fresh grocery product,10.94,https://via.placeholder.com/300x300?text=No+Image
36806,French Onion Party Dip,French Onion Party Dip,8.66,https://via.placeholder.com/300x300?text=No+Image
36878,Caesar Salad,"Salade composée de salade verte, de crudités et de poulet rôti traitée en salaison accomapgnée d'une sauce caesar",1.57,https://images.openfoodfacts.org/images/products/336/765/100/4878/front_fr.123.400.jpg
36919,Garden Vegetable,Vegetable soup,11.09,https://images.openfoodfacts.org/images/products/505/605/330/5802/front_en.3.400.jpg
36930,Taramosalata,Odysea Taramosalata Dip,7.04,https://images.openfoodfacts.org/images/products/502/922/301/2244/front_en.3.400.jpg
36988,Low Salt Ham,Dés de jambon,3.03,https://images.openfoodfacts.org/images/products/309/575/633/0010/front_en.88.400.jpg
37010,Organic Veggie Italian Sausage,Organic Veggie Italian Sausage,5.89,https://via.placeholder.com/300x300?text=No+Image
37025,Raw Spicy Veggie Wrappers,Quality raw spicy veggie wrappers - fresh grocery product,8.45,https://via.placeholder.com/300x300?text=No+Image
37112,Everything Hommus,Everything hommus,9.09,https://via.placeholder.com/300x300?text=No+Image
37119,Uncured Pepperoni,uncured pepperoni frozen pizza,10.71,https://images.openfoodfacts.org/images/products/002/066/200/6011/front_en.4.400.jpg
37145,Select Natural Applewood Smoked Turkey Breast,Quality select natural applewood smoked turkey breast - fresh grocery product,8.51,https://via.placeholder.com/300x300?text=No+Image
37147,Organic Soy Tempeh,"Surata soyfoods, organic original soy tempeh",11.06,https://via.placeholder.com/300x300?text=No+Image
37153,Naturals Smoked Turkey Breast,All natural hickory smoked turkey breast,14.58,https://images.openfoodfacts.org/images/products/004/141/523/1801/front_en.3.400.jpg
37163,Hummus Cucumber and Tomato Sandwich,Quality hummus cucumber and tomato sandwich - fresh grocery product,8.53,https://via.placeholder.com/300x300?text=No+Image
37167,Mustard Potato Salad,Mustard Potato Salad,6.53,https://via.placeholder.com/300x300?text=No+Image
37182,Chinese Style Noodles,Chow Mein Noodles,2.3,https://images.openfoodfacts.org/images/products/000/002/010/3699/front_en.114.400.jpg
37192,Smart Ground Original Veggie Protein Crumbles,Quality smart ground original veggie protein crumbles - fresh grocery product,9.78,https://via.placeholder.com/300x300?text=No+Image
37201,Kalamata Hummus,HUMMUS con olivas de Kalamata,3.26,https://images.openfoodfacts.org/images/products/848/000/080/8929/front_es.29.400.jpg
37258,Butternut Squash Soup,Chicken and Lentil with Butternut Squash,5.74,https://images.openfoodfacts.org/images/products/505/605/330/8803/front_en.11.400.jpg
37274,Tryst Black Bean Hummus,Quality tryst black bean hummus - fresh grocery product,3.69,https://via.placeholder.com/300x300?text=No+Image
37337,Kalamata Olive Tapenade,Kalamata Olive Tapenade,9.97,https://images.openfoodfacts.org/images/products/000/000/045/8306/front_en.3.400.jpg
37365,Fiery Sriracha,Fiery Sriracha Thai Classic,1.3,https://images.openfoodfacts.org/images/products/500/015/707/5338/front_fr.8.400.jpg
37432,Lunchables Turkey & Low Fat Cheddar Cheese Meal Combinations,Quality lunchables turkey & low fat cheddar cheese meal combinations - fresh grocery product,13.2,https://via.placeholder.com/300x300?text=No+Image
37443,Taco Dip,Premium taco dip - high quality grocery product,5.49,https://images.openfoodfacts.org/images/products/400/401/901/0261/front_en.4.400.jpg
37450,Falafel Balls,"Falafels made with chickpeas, onion and coriander",9.63,https://images.openfoodfacts.org/images/products/501/368/330/5589/front_en.83.400.jpg
37455,Smoked Ham,"Meat free smoked ham flavour deli slices, made with mycoprotein",11.2,https://images.openfoodfacts.org/images/products/501/950/303/4165/front_en.49.400.jpg
37472,Green Chile Hummus,Roasted Hatch Green Chile Hummus,12.27,https://images.openfoodfacts.org/images/products/082/298/610/3052/front_en.3.400.jpg
37501,Chorizo Picante Hot,Quality chorizo picante hot - fresh grocery product,9.61,https://via.placeholder.com/300x300?text=No+Image
37502,French Onion Veggie Dip,French Onion Veggie Dip,11.06,https://images.openfoodfacts.org/images/products/007/020/052/2039/front_en.5.400.jpg
37515,Olive Bruschetta,Bruschetta - Olives vertes et sel de mer,5.8,https://images.openfoodfacts.org/images/products/380/020/045/2107/front_fr.11.400.jpg
37544,Eggplant Appetizer,"Cento, eggplant appetizer, caponata",5.77,https://via.placeholder.com/300x300?text=No+Image
37561,Artichoke Lemon Pesto,"Cibo naturals, pesto, artichoke lemon",5.83,https://via.placeholder.com/300x300?text=No+Image
37625,Guacamole Authentic,"Guacamole Authentic Recipe, Mild",5.83,https://images.openfoodfacts.org/images/products/076/711/951/1697/front_en.7.400.jpg
37658,Snack Pack Mini Classic,Minis Classic,7.78,https://images.openfoodfacts.org/images/products/702/355/000/1856/front_nb.11.400.jpg
37890,Roasted Tomato Basil Soup,New Covent Garden Slow Roasted Tomato & Basil Soup 700G,2.13,https://via.placeholder.com/300x300?text=No+Image
37927,Chicken Corn Dog,"Plump & juicy chicken franks dipped in honey-crunchy batter corn dogs, honey crunchy",1.62,https://via.placeholder.com/300x300?text=No+Image
37995,Calabrese Spicy Salame with Sangiovese Wine,Quality calabrese spicy salame with sangiovese wine - fresh grocery product,10.61,https://via.placeholder.com/300x300?text=No+Image
38043,Chopped Bbq Seasoned Ranch Chicken Salad Bowl,"Chopped salad blend, bbq ranch dressing, southwest style white chicken meat, black beans, four cheese blend, and tortilla strips bowl, bbq seasoned ranch salad with chicken",6.92,https://via.placeholder.com/300x300?text=No+Image
38142,Black Pepper Salami,Italian dry salami black pepper coated,4.68,https://images.openfoodfacts.org/images/products/003/810/100/9639/front_en.8.400.jpg
38212,Tomato Basil Bisque,Soup Mix Tomato Basil Bisque,6.4,https://images.openfoodfacts.org/images/products/000/002/603/2603/front_fr.12.400.jpg
